Citation Date,Standard Number / Description,Category,Corrected at Inspection,Correction Deadline Date,Date Correction Evaluated,Sections Violated,Standard Risk Level,Technical Assistance Given,Deficiency Narrative,Correction Narrative
05/28/2025,748.117(2) - Organization and Administration,Organization and Administration,Yes,05/28/2025,,C:Organization and Administration,Medium Low,No,The operation policy was missing supervision in regards to transitional living program. The operation updated their policy during the inspection. ,
05/28/2025,748.105(8) - Organization and Administration,Organization and Administration,Yes,05/28/2025,,C:Organization and Administration,Medium,No,The operation was missing a statement regarding delegating the responsibility and the need for notification or obtaining approval to make a report to the hotline. The operation did submit updated policies to reflect this requirement during the inspection. ,
05/28/2025,748.3271 - Safety and Emergency Practices,Safety and Emergency Practices,Yes,05/28/2025,,O:Safety and Emergency Practices,Medium,No,"During the walk-through, it was noticed that there were no first-aid kits at the operation. The operation came into compliance by producing first aid kits and storing them in an accessible location for employees. ",
05/28/2025,748.105(6) - Organization and Administration,Organization and Administration,Yes,05/28/2025,,C:Organization and Administration,High,No,The operation was missing 748.685(e) from their policy. The operation submitted an updated policy during the inspection. ,
05/28/2025,"748.1209(b)(13) - Admission, Service Planning, Discharge","Admission, Service Planning, Discharge",Yes,05/28/2025,,"I:Admission, Service Planning, Discharge",Medium Low,No,The operation child orientation handbook was missing grievance and complaint procedures. The operation did submit updated handbook with grievance policies and procedures. ,
05/28/2025,748.117(3) - Organization and Administration,Organization and Administration,Yes,05/28/2025,,C:Organization and Administration,Medium,No,The operation policies were missing the expected behaviors and consequences of the children in the program. The operation updated their polices during the inspection. ,
