Citation Date,Standard Number / Description,Category,Corrected at Inspection,Correction Deadline Date,Date Correction Evaluated,Sections Violated,Standard Risk Level,Technical Assistance Given,Deficiency Narrative,Correction Narrative
02/08/2024,748.2307(9) - Individual Standards Evaluated,Individual Standards Evaluated,No,03/14/2024,03/28/2024,Individual Standards Evaluated,Medium High,Yes,"Through interviews with children and staff, it was determined that staff are cursing directly at children to get them to comply. ","Several children were interviewed and described punishment as having a meal on the unit if they are not allowed to go to the cafeteria. All stated they get plenty of food.
An email was received from the operation. Senior Leadership Directors have been notified of the issue of staff using profanity around patients.  Human Resources has been contacted to have training added to HealthStream for all direct care staff in Speaking Respectfully to Patients and  Standards of Professional Conduct.  Patient Advocate and Senior Leadership will conduct follow-up interviews with patients and staff members to ensure that staff are speaking in an appropriate and therapeutic manner to patients and to other staff members.  Staff that are not using appropriate language are receiving training and disciplinary actions to correct the issue.  "
12/11/2023,748.303(a)(2)(A) - Individual Standards Evaluated,Individual Standards Evaluated,No,02/22/2024,03/11/2024,Individual Standards Evaluated,Medium High,Yes,Review of the documentation and CLASS verified it was made known a child had a serious injury on 12/5/23 but the Hotline was not notifiied until 12/11/23. ,Interviews and walk through completed for new protocols on Serious Incident reporting. 
12/11/2023,748.2307(9) - Individual Standards Evaluated,Individual Standards Evaluated,No,02/16/2024,02/27/2024,Individual Standards Evaluated,Medium High,Yes,Throughout the course of the investigation multiple staff and children admitted that staff use profanity around the children.,"Senior Leadership Directors have been notified of the issue of staff using profanity around patients.  Human Resources has been contacted to have training added to HealthStream for all direct care staff in Speaking Respectfully to Patients and  Standards of Professional Conduct.  Patient Advocate and Senior Leadership will conduct follow-up interviews with patients and staff members to ensure that staff are speaking in an appropriate and therapeutic manner to patients and to other staff members.  

2/27/24 an Unannounced Inspection was conducted and staff were interviewed and validated they have been spoken with about how to speak with residence and there is training's on their portal. "
12/11/2023,748.3365(c)(3) - Individual Standards Evaluated,Individual Standards Evaluated,No,02/16/2024,02/16/2024,Individual Standards Evaluated,Medium,Yes,During the course of the investigation several staff stated children would wet their beds and not get clean sheets. There was a bedroom observed during the walk through with soiled linens. ,"Director of Plant Ops, Campus Administrator, Housekeeping Supervisor, and Director of Nursing/Interim Program Director are performing daily checks of the units for cleanliness.  Housekeeping Supervisor has implemented janitorial logs for each unit that state what cleaning services was done on the unit that day.  Director of Nursing/Interim Program Director has retrained nurses and MHTs that they are to ensure that all bedding is clean.  Any bedding that is soiled is changed out immediately and new clean bedding placed on patient beds. Senior leadership are spot checking rooms and units daily to ensure that the units are clean, and that staff have signed the checklist verifying that they have a clean unit.  Communication of unit cleanliness will be discussed in daily flash meetings and in weekly unit meetings."
12/11/2023,748.3301(a)(2) - Individual Standards Evaluated,Individual Standards Evaluated,No,02/16/2024,02/16/2024,Individual Standards Evaluated,Medium,Yes,During the walkthrough trash was observed throughout the walkthrough of Liberty Hall.,"Director of Plant Ops, Campus Administrator, Housekeeping Supervisor, and Director of Nursing/Interim Program Director are performing daily checks of the units for cleanliness.  Staff (MHTs and Nurses) have been retrained that the expectations are that there is to be no food in patient rooms, rooms are cleaned, and items picked up off the floor in bedrooms, and trash is to be picked up on units.  Cleanliness of rooms and the unit has been added to the staff assignment checklist which is signed off on daily.  Senior leadership are spot checking rooms and units on a daily to ensure that the units are clean, and that staff have signed the checklist verifying that they have a clean unit.  Communication of unit cleanliness will be discussed in daily flash meetings and in weekly unit meetings."
12/11/2023,748.1005 - Individual Standards Evaluated,Individual Standards Evaluated,No,02/16/2024,02/27/2024,Individual Standards Evaluated,Medium High,Yes,Throughout the course of the investigation multiple staff admitted to the operation being out of ratio. Nurses at the operation were working as direct care givers and as nurse at the same time while being counted in ratio.,"All staff have been trained that if they become aware of a ratio issue that they are to notify their immediate supervisor, Program Director, and/or Director of Nursing so that the ratio issue can immediately be addressed.  If a nurse is counted in ratio and responsible for patient care, then prior to the nurse performing nursing related duties, the nurse will notify their immediate supervisor or DON so that a staff member can replace the nurse during that time so that ratio is maintained.  Shift Hound is being monitored daily by the Director of Nursing/Interim Program Director to ensure that ratios are maintained and any areas that need staffing are addressed timely.

2/27/24 Inspection was conducted at the facility and they were observed to be in compliance with ratio."
12/11/2023,748.685(a)(3) - Individual Standards Evaluated,Individual Standards Evaluated,No,02/16/2024,02/27/2024,Individual Standards Evaluated,High,Yes,During the walkthrough of the operation a child was observed in his room alone with no caregiver within visual or auditory range of the child.,"PI/Risk Management Analyst immediately addressed the supervision issue with the staff member responsible for the patient while on the unit during the walk-thru with licensing.  All direct care staff were trained in October 2023 with the Patient Safety Observation training module video series with documented attestation of the training in the employee personnel files.  All new staff have been trained in Patient Safety Observation Rounds during new hire orientation with documented attestation of the training in the employee personnel files.  The staff member was re-educated on Patient Safety Observation Rounds training protocols.  This training specifically outlines patient supervision requirements, patients are not left alone in patient bedrooms during the programming day, patient bedrooms are locked during the programming day, and patients are to use the community bathroom during programming hours.  

2/27/24 An unannounced inspection was conducted and all children were being supervised appropriately."
12/06/2023,748.2307(8) - Individual Standards Evaluated,Individual Standards Evaluated,No,02/12/2024,02/08/2024,Individual Standards Evaluated,Medium High,Yes,A caregiver yelled at a child in an untherapeutic way after the child had run away from the operation. ,Received and reviewed documenation with staff's signature showing the staff was retrained. 
11/30/2023,748.685(c)(2) - Individual Standards Evaluated,Individual Standards Evaluated,No,01/25/2024,02/08/2024,Individual Standards Evaluated,High,Yes,An unsafe environment was created when all staff intervened in one incident leaving other children with previous physical altercation issues unsupervised allowing a third altercation between the two children.,
11/16/2023,748.685(a)(3) - Individual Standards Evaluated,Individual Standards Evaluated,No,12/22/2023,01/09/2024,Individual Standards Evaluated,High,Yes,In the course of the investigation it was determined staff was doing other duties and was not aware of the childrens' actions allowing them to leave the premises.,In the course of the investigation it was determined staff was doing other duties and was not aware of the childrens' actions allowing them to leave the premises.
11/16/2023,748.507(1) - Individual Standards Evaluated,Individual Standards Evaluated,No,12/22/2023,01/09/2024,Individual Standards Evaluated,Medium High,Yes,In the course of the investigation it was found a staff member left the key to all doors accessible to a child in care allowing them the opportunity to elope from the facility. ,In the course of the investigation it was found a staff member left the key to all doors accessible to a child in care allowing them the opportunity to elope from the facility. 
10/31/2023,748.303(a)(2)(A) - Individual Standards Evaluated,Individual Standards Evaluated,No,01/05/2024,01/09/2024,Individual Standards Evaluated,Medium High,Yes,A child went to the emergency room on 8/19/23 after having a seizure. Another child went to the emergency room on 9/17/23 after having a seizure. Another child went to urgent care on 8/12/23 for a fractured finger. These incidences were not reported to Licensing. ,A child went to the emergency room on 8/19/23 after having a seizure. Another child went to the emergency room on 9/17/23 after having a seizure. Another child went to urgent care on 8/12/23 for a fractured finger. These incidences were not reported to Licensing. 
10/10/2023,748.1005 - Individual Standards Evaluated,Individual Standards Evaluated,Yes,10/10/2023,,Individual Standards Evaluated,Medium High,Yes,"It was determined that Bunk House was out of ratio, 17:2, for more than 15 minutes as one staff was in the Nurse s station conducting administrative duties and speaking to children individually, and another staff left Bunk House to drop off her personal items in the Admin building. A nurse was in the Med room performing medication/administrative duties. ",
10/10/2023,748.3365(c)(3) - Individual Standards Evaluated,Individual Standards Evaluated,No,10/17/2023,10/17/2023,Individual Standards Evaluated,Medium,No,"During the walk-through of Eagle unit located in Liberty Hall, it was noted that one child s pillow was complete stained and had red circular stains on it. Please refer to 748.3015, if applicable."," As per the Administrator/Director of Risk Management, Director of Performance Improvement, & Facility Compliance Officer, the direct care and housekeeping staff have been notified about the concern. The bedding was changed out and staff will be more diligent in inspecting pillowcases to ensure that they are clean and freshly washed. The wash schedule for the patients is on a weekly basis. Staff will ensure that clean linens are available, as necessary.  One note is that no linens were used by more than one patient.  All linens are stripped after a patient discharge and laundered to ensure the highest level of cleanliness and sanitation.  "
09/29/2023,748.685(a)(5) - Individual Standards Evaluated,Individual Standards Evaluated,No,12/06/2023,01/09/2024,Individual Standards Evaluated,High,Yes,"It was documented and made known that a child was not adequately supervised as they were able to open locked doors, leave the unit and climb the buildings roof multiple times without staff being aware he was absent from the unit. It was also recorded that the child was able to leave the unit and jump the propertys fence in which resulted in injuries. ","As per the operations Administrator, the operation will ensure that all staff remain in close proximity of all patients who display elopement tendencies.  
1/9/23 Met with Administrator, Director of Nursing, Program Manager, and Risk Manager the facility will now have the child at the Oasis, off the Unit, with a MHT. If the child must remain on the Unit a MHT will be placed with them to prevent having nurses to fill in. 
RCCR Inspector also observed children walking from different areas of the campus to school and all were in ratio. "
09/10/2023,748.3319(a) - Physical Site,Physical Site,No,11/06/2023,10/09/2023,P:Physical Site,Medium,Yes,Operation did not have required No Trespassing signs posted at entrance of facility.,"Original compliance date was 10/10/23. Operation ordered signs from HHSC and as of 10/9 they have not received yet. Extension granted until 11/6/23. Anita Orr
On 10/9/23 Inspector Orr had extended the compliance to 11/6/23. At this time the signs have still not arrived, but Glenn Scruggs (Administrator) was able to verify they had been ordered. Per Supervisor Leon the etension will be found compliant. MLayton"
07/27/2023,748.930(b)(1)(A) - Individual Standards Evaluated,Individual Standards Evaluated,No,08/17/2023,08/28/2023,Individual Standards Evaluated,Medium High,Yes,Two staff files were reviewed for EBI training documentation and both were missing documentation verifying annual EBI training was completed. ,Two staff files were reviewed for EBI training documentation and both were missing documentation verifying annual EBI training was completed.
07/27/2023,748.2455(a)(2) - Emergency Behavior Intervention,Emergency Behavior Intervention,No,08/17/2023,08/28/2023,N:Emergency Behavior Intervention,Medium High,Yes,Caregivers conducted an unwarranted restraint on a child in care as the child was running away.,Caregivers conducted an unwarranted restraint on a child in care as the child was running away.
07/27/2023,748.311 - Individual Standards Evaluated,Individual Standards Evaluated,No,08/17/2023,08/28/2023,Individual Standards Evaluated,Medium,Yes,"10 of 10 serious incident reports were reviewed and none documented the operation's address or phone number, or the child's date of admission as required.","10 of 10 serious incident reports were reviewed and none documented the operation's address or phone number, or the child's date of admission as required."
05/16/2023,748.1331(b)(3) - Individual Standards Evaluated,Individual Standards Evaluated,No,05/26/2023,06/12/2023,Individual Standards Evaluated,Medium Low,Yes,"During the inspection, two of six child files reviewed did not identify the level of observation required in the preliminary service plan.  ",This standard was reviewed and found to be compliant.
05/16/2023,748.833(a)(2) - Training and Professional Development,Training and Professional Development,No,05/26/2023,06/12/2023,F:Training and Professional Development,Medium,Yes,Three out of ten staff files reviewed were missing the signed policy related to reporting abuse and neglect.  ,This standard was reviewed and found to be compliant.
03/15/2023,748.1337(b)(1)(D)(ii) - Individual Standards Evaluated,Individual Standards Evaluated,No,04/20/2023,04/19/2023,Individual Standards Evaluated,Medium High,Yes,In reviewing the Initial Service Plan there was no direction on supervision provided. ,Received a copy of the new form for Service Plan. An area has been added for High Risk Behaviors and instructions to staff. Mlayton 
02/21/2023,748.1003(a) - Individual Standards Evaluated,Individual Standards Evaluated,No,03/27/2023,04/14/2023,Individual Standards Evaluated,Medium High,Yes,"During the investigation, documents reviewed show the census and staffing schedule show several days in February where the Hacienda unit was out of ratio.","An email from the operations LCCA, Glen Scruggs, was received stating the following :

Regarding 748.1003 (a) and 748.535 (3)(A)

I have addressed the staffing concerns with Program, Human Resources, and Nursing Directors.  Meridell is continuing to hire MHTs and Nursing staff so that we can develop a true PRN pool that is available when a staff member calls in sick or is scheduled to be out on PTO.  I just taught a New Employee Orientation Class that included 13 MHTs and 2 Nurses.  We have another New Employee Orientation Class that begins on 4/24 as well.  We plan on continuing to hire so that we always have a pool of staff ready when staffing needs change.  We are also reviewing shift hound daily to plug any areas of concern so that all shifts are covered and remain in ratio.  I am communicating with Program Director, Nursing, Human Resources, and CEO when any concerns are brought to my attention regarding potential ratio concerns so that they are addressed immediately to ensure that ratios and staffing patterns are maintained.
"
02/21/2023,748.930(b)(2) - Individual Standards Evaluated,Individual Standards Evaluated,No,04/14/2023,04/14/2023,Individual Standards Evaluated,Medium High,Yes,"7 of 8 direct care staff files pulled are missing 1 or all of the annual required trainings: Normalcy, Trauma Informed Care and EBI","An email from the operations LCCA, Glen Scruggs, was recieved and stated the following : Regarding 748.930 (b)(2)
All active staff have completed the required trainings.   Human Resources has created a monitoring schedule to ensure that these specific trainings are tracked so that employees do not lapse on their training.
"
02/21/2023,748.535(3)(A) - Individual Standards Evaluated,Individual Standards Evaluated,No,03/27/2023,04/14/2023,Individual Standards Evaluated,Medium High,Yes,"During the investigation, documents reviewed show the census and staffing schedule show several days in February where the Hacienda unit was out of ratio.","An email from the operations LCCA, Glen Scruggs, was received stating the following :

Regarding 748.1003 (a) and 748.535 (3)(A)

I have addressed the staffing concerns with Program, Human Resources, and Nursing Directors.  Meridell is continuing to hire MHTs and Nursing staff so that we can develop a true PRN pool that is available when a staff member calls in sick or is scheduled to be out on PTO.  I just taught a New Employee Orientation Class that included 13 MHTs and 2 Nurses.  We have another New Employee Orientation Class that begins on 4/24 as well.  We plan on continuing to hire so that we always have a pool of staff ready when staffing needs change.  We are also reviewing shift hound daily to plug any areas of concern so that all shifts are covered and remain in ratio.  I am communicating with Program Director, Nursing, Human Resources, and CEO when any concerns are brought to my attention regarding potential ratio concerns so that they are addressed immediately to ensure that ratios and staffing patterns are maintained.
"
01/24/2023,745.641 - Individual Standards Evaluated,Individual Standards Evaluated,No,01/26/2023,02/01/2023,Individual Standards Evaluated,High,Yes,"During the inspection, it was found that the Administrator doesn't have a background check under this operation.","The background check for the individual providing assistance from the sister company has been run under this operation.

On 2/3/23, the operation also emailed and reported their current process for running background checks for new hires is listed below. These steps are completed for ALL employees, contractors and anyone on the campus that has direct or indirect involvement with children:
	All employees are submitted through the Texas Health & Human Services Child Care Licensing (form that is filled out and submitted by HR attached) 
	They also use a standardized program, PreCheck, that verifies positive identification of the individual, maiden/alias search, employment verification, education verification, sex offender registry list, national criminal history, statewide criminal search, county level criminal history, and SanctionCheck screening (form outlining the process is attached) 
	PreCheck transport package is also submitted for anyone operating a vehicle or transporting children. 

They reported moving forward they will request background checks from facilities for any employees they share or will request new background checks."
12/06/2022,"748.1331(b)(4) - Admission, Service Planning, Discharge","Admission, Service Planning, Discharge",No,12/16/2022,12/21/2022,"I:Admission, Service Planning, Discharge",Medium,Yes,Six out of six child records reviewed did not include issues that could escalate the child in cares behavior in the preliminary service plan.  ,"CEO provided the following plan: 
i.	Confirm with Director of Nursing (DON) where Crisis Safety Plan is documented in childs record 
ii.	Request medical records file document in Treatment Planning Tab 
iii.	Crisis Safety Plan includes patient identified behaviors  will be attached and filed to Initial Treatment Plan AND filed accordingly
iv.	Est completion January 18th, 2023 
"
12/06/2022,748.393(b)(2) - Individual Standards Evaluated,Individual Standards Evaluated,No,12/16/2022,12/21/2022,Individual Standards Evaluated,Medium High,Yes,Four out of ten child records did not list the known allergies or chronic conditions in a prominent place on the child file and one child record reviewed did not list a medication allergy.,"The CEO provided the following plan: i.	Admissions will continue to send emails with patients admitting to unit with information that includes any and all medication, food and other allergies included. Admitting nurse will verbally relay information, which will include all allergies including ones stated above, to the receiving/unit nurse. 
ii.	The admissions nurse or unit nurse with transcribe all allergies to the allergy chart sticker/indicator and place it on the bound side of the chart for quick reference. 
iii.	If no allergies are noted upon admission, NKDA will be indicated
iv.	This will be audited and noted during supervisory rounds which take place weekly by administration. If no allergy sticker is observed then the auditor will notify the unit nurse immediately and reported to the DON.
i.	Admissions will continue to send emails with patients admitting to unit with information that includes any and all medication, food and other allergies included. Admitting nurse will verbally relay information, which will include all allergies including ones stated above, to the receiving/unit nurse. 
ii.	The admissions nurse or unit nurse with transcribe all allergies to the allergy chart sticker/indicator and place it on the bound side of the chart for quick reference. 
iii.	If no allergies are noted upon admission, NKDA will be indicated
iv.	This will be audited and noted during supervisory rounds which take place weekly by administration. If no allergy sticker is observed then the auditor will notify the unit nurse immediately and reported to the DON.
"
12/06/2022,748.3365(b)(2) - Physical Site,Physical Site,No,12/16/2022,12/21/2022,P:Physical Site,Medium,Yes,Five  mattresses in seventeen rooms inspected had torn mattress and mattress covers. One of the mattresses was being used by a child and it was replaced at the time of inspection.,"CEO provided the following plan: 
i.	All mattresses on campus that had a tear in the mattress, or the cover have been replaced as of 12/21/22 with mattresses that fit the requirement of this standard. 
ii.	The Maintenance department will conduct monthly environment of care audits to ensure that all mattresses/covers are in good repair and will replace one if it does have a torn mattress/cover. 
"
12/06/2022,"748.1339(c) - Admission, Service Planning, Discharge","Admission, Service Planning, Discharge",No,12/16/2022,12/21/2022,"I:Admission, Service Planning, Discharge",Low,Yes,Six out of six child records reviewed did not document an invitation for the parent or child to participate in the development of the service plan.,"Plan provided by CEO states te following:
i.	Create letter to invite families via email and notify of child inclusion in Staffing/ Treatment Plan Review 14 days prior to scheduled Staff meeting
ii.	Using the Master Treatment Plan, review schedule for each unit to identify what children are due for review
iii.	Therapists will be responsible for emailing letters to identified families by 14 day advance deadline  
iv.	Letter will be placed in child record as proof of invitation to include family and child in staffing and Treatment Plan Review
v.	Therapist will be responsible for notifying child of invitation and right to attend staffing and treatment planning review
vi.	Therapists will document on Treatment Team Staffing signature page if child and/or family refusal 
vii.	Est. completion January 18th, 2023
"
12/06/2022,"748.1337(b)(1)(D) - Admission, Service Planning, Discharge","Admission, Service Planning, Discharge",No,12/16/2022,12/21/2022,"I:Admission, Service Planning, Discharge",Medium,Yes,Six out of six child records reviewed failed to incorporate individualized and specific goals or instructions to caregivers how to accomplish those goals.,"CEO provided the following plan: 
i.	On Master Treatment Plan, Therapists will include Parenting Strategies on every Treatment Plan. 
ii.	Therapist will meet with family during family therapy session to identify specific, individualized goals and interventions on how parent(s) will meet the need of the child
iii.	Est completion January 18th, 2023 
"
