Citation Date,Standard Number / Description,Category,Corrected at Inspection,Correction Deadline Date,Date Correction Evaluated,Sections Violated,Standard Risk Level,Technical Assistance Given,Deficiency Narrative,Correction Narrative
06/04/2025,745.635(2) - Individual Standards Evaluated,Individual Standards Evaluated,No,07/24/2025,07/18/2025,Individual Standards Evaluated,High,Yes,"An administrative penalty will be recommended as a result of this citation, per HRC §42.078","RCCR received an email from Mr. Scruggs for compliance on 7/18/25.
Standard 745.635 (2) AP Background check determination  if ineligible then you must immediately remove subject from the operation and confirm to CBCU receipt of notice letter.

The standard was reviewed with Human Resources department staff members and coaching/clarification was provided by Glenn Scruggs  the Licensed Child Care Administrator on 7/17/25 that when a staff member is deemed ineligible that they must be removed from the schedule that day, notify the CBCU that the employee has been removed from the schedule, and ensure that the staff member has been timely deactivated with the CBCU and is no longer associated with Meridell Achievement Center within the specified timeline per minimum standards.  I have advised that the HR department review the background checks and if there are any questions related to a background check that they consult with me as the Campus Administrator for guidance and clarification.  The HR department will review the provider login page at least twice a week to ensure that they are monitoring the background checks and other items that need to be addressed on the site.   
"
03/30/2025,748.1003(a) - Individual Standards Evaluated,Individual Standards Evaluated,No,05/05/2025,05/19/2025,Individual Standards Evaluated,Medium High,Yes,"Through interviews staff as well as documentation provided, it is determined one of the units on campus was out of ratio during the time of the altercation on 03/30/2025.","On 5/5/25 the operation indicated that they are having administrative staff review staffing schedules, continue to hire MHT's and nursing staff to ensure ratio. On 5/19/25 an inspection was conducted, and children were interviewed regarding ratio and language. No concerns noted."
03/30/2025,748.507(1) - Individual Standards Evaluated,Individual Standards Evaluated,No,05/05/2025,05/19/2025,Individual Standards Evaluated,Medium High,Yes,Residents interviewed consistently mentioned a staff member used profane language. One staff member was told by several residents that a staff member has use profane language.  Another staff member stated he had heard a staff member used profane language.,Residents were interviewed regarding cursing. Administrator also provided training to the staff involved. 
02/11/2025,748.2551(b)(2) - Individual Standards Evaluated,Individual Standards Evaluated,No,03/10/2025,03/14/2025,Individual Standards Evaluated,Medium High,Yes,"An inappropriate restraint was completed by a staff on a child. Staff lunged at the child tackling the child to the ground. A proper hold could not be completed, but staff continued to wrestle with the child for 30-45 seconds until another staff responded. ","Although this is not pulling over into the INV follow-up, the inspection for this follow-up was completed on INSP# 4047160. CCR received an email on 3.10.25 explaining the staff that was involved in the investigation had been terminated. 

RCCR VLopez conducted a follow up at Meridell on 3/14/25. Interviews with children and staff regarding Emergency behavior interventions, de-escalation, training, and caregiver responsibility.  No concerns were noted during these interviews. "
01/22/2025,748.685(a)(5) - Individual Standards Evaluated,Individual Standards Evaluated,No,03/14/2025,03/14/2025,Individual Standards Evaluated,High,Yes,"During the course of the investigation, a staff member admitted they did not intervene when an altercation took place between two children in care.  ",
01/11/2025,748.3301(a)(2) - Physical Site,Physical Site,No,01/27/2025,01/27/2025,P:Physical Site,Medium,Yes,Grates in 4 of the doors at the gym were found to be bent. The pool was found to be dirty and the bottom could not be seen. Trash was foun through out all of the buildings. ,"The grates in the gym were inspected by Director of Plant Ops and replacement metal grates have been ordered (1/14/25) and will be replaced when they arrive at the facility.  The pool was shocked with chemicals (1/14/25) and the pool water is now blue and clear in color.  Staff were reminded (1/15/25) to pick up empty water bottles and as we discussed, the patients were involved in indoor arts and crafts activities which is why there was paper and art supplies on the floor int the dayroom areas.  Staff were instructed to be more proactive and to pick up things as they go through the activities to ensure there is not clutter present."
11/29/2024,748.2551(b)(2) - Individual Standards Evaluated,Individual Standards Evaluated,No,01/28/2025,02/10/2025,Individual Standards Evaluated,Medium High,Yes,It was determined staff were unable to restrain the child using techniques that were approved by the facility. The staff and 3 collateral witnesses verified this information.,"The operation provided documentation of 1 week of suspension without pay for Marian Fields dated 12/3/24 for violating Policy HR 403  Aggressive behavior including but not limited to verbal or physical abuse/threats, swearing, or intimidating behavior directed towards a patient, visitor, or facility employee.
Training record for Mareion Fields dated 12/13/24. 4 hours of verbal de-escalation. Signed by trainer Jim Pennymore. Review of Key points in a crisis, working styles in crisis and stages, preventing power struggles, active listening, and tagging in or out.

On 2/10/25 RCCCR held interviews with children and staff indicating that only permitted types of EBI are being used. The operation will continue to use refresher EBI training to ensure compliance. Inspection #4037759
"
11/29/2024,748.2463(3) - Individual Standards Evaluated,Individual Standards Evaluated,No,01/28/2025,02/10/2025,Individual Standards Evaluated,Medium High,Yes,The staff in question stated they did an escort when the victim refused to leave the Dayroom. 3 Collateral Staff stated an escort was done because the victim refused to leave the Dayroom.,"The operation provided documentation of 1 week of suspension without pay for Marian Fields dated 12/3/24 for violating Policy HR 403  Aggressive behavior including but not limited to verbal or physical abuse/threats, swearing, or intimidating behavior directed towards a patient, visitor, or facility employee.
Training record for Mareion Fields dated 12/13/24. 4 hours of verbal de-escalation. Signed by trainer Jim Pennymore. Review of Key points in a crisis, working styles in crisis and stages, preventing power struggles, active listening, and tagging in or out.

On 2/10/25 RCCR held interviews with children and staff indicating that EBI is being used according to standards and not for compliance. The operation will continue to use refresher EBI training to ensure compliance. Inspection #4037759
"
11/27/2024,748.151(3) - Individual Standards Evaluated,Individual Standards Evaluated,No,02/14/2025,02/10/2025,Individual Standards Evaluated,Medium,Yes,"During the investigation, it was discovered that a child's records was not documented accurately.",The operation has discussed the importance of true and accurate documentation and records with staff in staff meetings and training.
10/18/2024,748.1553 - Individual Standards Evaluated,Individual Standards Evaluated,No,12/16/2024,01/07/2025,Individual Standards Evaluated,High,Yes,Documentation reviewed determined a child was assessed and concerns of a  serious injury were suspected on 7/29/30 but the child was not given treatement until 7/30/24.  Upon Follow up it has been determined the facility will continue with their current protocols. ,"New protocol is that the nurse will assess a child's injury. During business hours Mobile X-Ray will be notified to come on the same day. During Holidays or after hours, nurse will assess. If X-Ray is need the Mobile X-Ray will be notified as STAT. If they do not arrive by the end of the shift the child will automatically be sent to the hospital. X-Ray mobile is contracted for 24/7 Service. "
10/18/2024,748.1101(b)(1)(B) - Individual Standards Evaluated,Individual Standards Evaluated,No,12/18/2024,01/07/2025,Individual Standards Evaluated,High,Yes,"A caregiver failed to adhere to the child's rights to be free of abuse, neglect, and exploitation as defined in Texas Family Code 261.401.",Resignation Letter dated for 12/13/24 and review of the background checks validated the staff is no longer employed.
10/18/2024,748.2307(8) - Individual Standards Evaluated,Individual Standards Evaluated,No,12/18/2024,01/07/2025,Individual Standards Evaluated,Medium High,Yes,Through the course of the investigation it was determined a child was called a brat in front of other staff and children.,Resignation Letter dated for 12/13/24 and review of the background checks validated the staff is no longer employed. 
10/09/2024,748.3391(a) - Individual Standards Evaluated,Individual Standards Evaluated,No,10/09/2024,10/18/2024,Individual Standards Evaluated,Medium High,Yes,"In conducting a walk through of the facility a clogged toilet with feces, mildew in the bathroom, and toilet paper covered in bodily fluids. ",Restrooms were found to be clean and all repairs made. 
10/09/2024,745.641 - Individual Standards Evaluated,Individual Standards Evaluated,Yes,10/18/2024,,Individual Standards Evaluated,High,Yes,Review of the backgrounds found an employee had their background inactivated on 7-9-24 and is still having access to children in care. ,
10/09/2024,748.3301(a)(2) - Individual Standards Evaluated,Individual Standards Evaluated,No,10/16/2024,10/18/2024,Individual Standards Evaluated,Medium,Yes,"Three of Seven Units were found to have repairs needed, peeling paint, broken furniture, broken or missing air vents, and trash in several rooms and on the grounds around the homes. ",Operation must immediately remove the person from the operation until eligibility has been determined.
10/09/2024,"748.1349(a)(3) - Admission, Service Planning, Discharge","Admission, Service Planning, Discharge",No,10/16/2024,11/26/2024,"I:Admission, Service Planning, Discharge",Medium Low,Yes,It was determined that staff caring for children do are not easily able to access the Service Plans for the children they are caring for. ,It was determined that staff caring for children do are not easily able to access the Service Plans for the children they are caring for. 
09/30/2024,748.1005 - Individual Standards Evaluated,Individual Standards Evaluated,No,12/05/2024,01/07/2025,Individual Standards Evaluated,Medium High,Yes,"Three out of five collateral interviews stated the facility has been out of ratio. Another collateral made the statement ""when the facility is in ratio"" indicating there are times the facility is out of ratio. ",Walk through of the dorms was completed. The facilities were in ratio and extra staff was observed going from unit to unit. 
08/02/2024,748.3301(a)(1) - Physical Site,Physical Site,No,08/09/2024,08/13/2024,P:Physical Site,High,Yes,Multiple walls in units had derogatory writing on them. There were several bathrooms that had trash items in the sinks. One ceiling vent had what appeared to be mold or heavy dust on it. A bulletin board was observed to be broken in one of the rooms. Multiple units had large areas of peeled paint on the doors and walls. ,"Walk through was done of the dorms. All repairs had been made. 
The facility also hired a person to do nothing but paint."
07/13/2024,748.685(c)(6) - Individual Standards Evaluated,Individual Standards Evaluated,No,09/13/2024,09/17/2024,Individual Standards Evaluated,Medium,Yes,"Treatment Plans, Interviews, and video were reviewed during the investigation and determined children were to be checked on every 15 minutes and two of those checks were missed. ",Received notice from the Administrator that one of the staff involved resigned and the other was given counseling. 
06/20/2024,748.363(7) - Reports and Record Keeping,Reports and Record Keeping,No,07/22/2024,08/13/2024,D:Reports and Record Keeping,Medium,Yes,3 Staff Charts were reviewed did not have Licensing Affidavits. ,Reviewed charts from inspection and a new hire charts and all had Notarized Licensing Affidavits. 
05/20/2024,748.3391(a) - Individual Standards Evaluated,Individual Standards Evaluated,No,05/24/2024,06/20/2024,Individual Standards Evaluated,Medium High,Yes,During the walkthrough of the operation childrens bathrooms were observed with mildew in the shower and bathroom sinks have excessive gunk. ,Walk through was conducted of the units with no issues or concerns.
05/17/2024,748.685(a)(4) - Individual Standards Evaluated,Individual Standards Evaluated,No,06/20/2024,06/20/2024,Individual Standards Evaluated,High,Yes,"During the interview, both the Administrator and the therapist stated the resident was left unsupervised.",All staff have been retrained on Supervision. Verified by signature sheets. 
05/15/2024,748.303(a)(2)(A) - Individual Standards Evaluated,Individual Standards Evaluated,No,07/19/2024,08/13/2024,Individual Standards Evaluated,Medium High,Yes,A child in care sustained a fracture to their hand as confirmed by X Rays results that were provided to the operation on 5/11/24. The operation did not report this to Licensing until 5/14/24. ,Staff was retrained on timeframes and what to report as a Serious Incident.  
04/12/2024,748.681(1)(B) - Individual Standards Evaluated,Individual Standards Evaluated,No,06/05/2024,06/05/2024,Individual Standards Evaluated,Medium Low,Yes,In reviewing the investigation it was found a  person that was not a qualified caregiver was interacting with children and was left to supervise the children.,The staff was counseled on job description. The employee that asked the staff to watch the children is no longer employed. The facility has put into place you must be 21 years old to be employed. 
04/07/2024,748.2307(9) - Individual Standards Evaluated,Individual Standards Evaluated,No,06/05/2024,06/20/2024,Individual Standards Evaluated,Medium High,Yes,Three out of five children interviewed stated a staff member will cuss at them. ,Staff was retrained and placed on Performance Improvement Plan
04/06/2024,748.1531(d) - Individual Standards Evaluated,Individual Standards Evaluated,No,06/05/2024,06/20/2024,Individual Standards Evaluated,Medium High,Yes,Documenation and interviews verified the child was recommended for a follow-up on 1/23/24 and did not receive it. ,Nurse Manager stated they now have hired more Milieu workers to help transport. When a follow-up is given it is entered into the system and put on the calendar to ensure there is a transporter that day. 
04/04/2024,748.685(a)(3) - Individual Standards Evaluated,Individual Standards Evaluated,No,04/18/2024,05/15/2024,Individual Standards Evaluated,High,Yes,During the walk through a staff was observed in the Nurse's Station on their personal phone while 4 chidlren were out in the Day Room alone. ,Walk through was conducted. Staff interviewed. Ratio was found in compliance. Staff were retrained in April signed attendance forms.
04/04/2024,748.303(a)(4)(A) - Individual Standards Evaluated,Individual Standards Evaluated,No,04/05/2024,05/15/2024,Individual Standards Evaluated,Medium High,Yes,"In reviewing Serious Incidents it was found a fght occurred in which a child was iinjured and taken to the doctor, but never reported. ",All staff retrained. Training Logs acquired
04/04/2024,745.641 - Individual Standards Evaluated,Individual Standards Evaluated,No,04/11/2024,05/15/2024,Individual Standards Evaluated,High,Yes,In reviewing background checks if was found two employees did not have active backgrounds checks.,People List reviewed and backgrounds had been completed. 
04/04/2024,748.1337(b) - Individual Standards Evaluated,Individual Standards Evaluated,No,04/18/2024,05/15/2024,Individual Standards Evaluated,Medium Low,Yes,"In reviewing the Admission Assessment, Preliminary Service Plans, and  Initial Service Plans, several items that are required were found not to be included. ",Corrections for this have been added to the POA. Also the facility has begun to transform their forms. 
04/01/2024,748.2855(a) - Individual Standards Evaluated,Individual Standards Evaluated,No,06/25/2024,06/20/2024,Individual Standards Evaluated,Medium,Yes,Interviews validated there was no documentation written for the restraint. ,A new EBI form was created and staff were retrained on Serious Incident Reporting. 
04/01/2024,748.2307(8) - Individual Standards Evaluated,Individual Standards Evaluated,No,07/03/2024,06/20/2024,Individual Standards Evaluated,Medium High,Yes,Interviews from 6 persons validated that staff yelled at children when behaviors started to escalate. ,All staff were retraiined on Trauma infromed care.
03/28/2024,748.1009 - Individual Standards Evaluated,Individual Standards Evaluated,No,05/02/2024,05/15/2024,Individual Standards Evaluated,High,Yes,"A physical altercation occurred on 3.28.24 in a unit that was out of ratio. Due to this, a child had to call the code to get additional staff to respond. 
Not having enough staff to respond to codes was brought up numerous times during interviews with children and staff. 
Additionally, an incident occurred where a child was left in a unit for approximately 15 minutes without a staff. The nurse was double covering that day and staff believed the nurse was inside, however, she had left to check on the other unit. 
",Walk through was conducted. Staff interviewed. Ratio was found in compliance. Staff were retrained in April signed attendance forms.
03/28/2024,748.1007(b)(1) - Individual Standards Evaluated,Individual Standards Evaluated,No,05/02/2024,07/20/2024,Individual Standards Evaluated,Medium High,Yes,The operation was out of ratio overnight on at least 3 occurrences in 1-2 units. ,"An email was received on 5.2.24 from the Administrator. Campus Administrator is working alongside the Program and Nursing Departments to ensure that ratios and staffing patterns are in compliance with standards. The schedule tool Shift Hound, which Meridell utilizes is being reviewed and updated daily to reflect current, true, accurate, and complete records of staffing on the units.  
Schedules were reviewed and found there were not staff scheduled for the amount of children in placement."
03/28/2024,748.507(1) - Individual Standards Evaluated,Individual Standards Evaluated,No,05/03/2024,06/20/2024,Individual Standards Evaluated,Medium High,Yes,3 staff and 3 children noted staff are passive aggressive and/or rude towards the children.,"An email was received on 5.2.24 from the Administrator. Pt. Advocate will respond to all patient complaint forms and address written complaints with patients on a weekly basis.  Documentation of the patient complaint forms with the outcome/resolution are available for review with the patient advocate.  Any employees who are confirmed to have violated patient rights will be referred to their immediate supervisor for coaching, retraining, and possible disciplinary actions, as necessary.  
Administrator has been working to hire new employees, retrain the current employees, and release staff that are not following the Minimum Standards. "
03/28/2024,748.2307(8) - Individual Standards Evaluated,Individual Standards Evaluated,No,05/03/2024,06/20/2024,Individual Standards Evaluated,Medium High,Yes,5 staff and 2 children stated staff yell at children in care. ,"An email was received on 5.2.24 from the Administrator. Pt. Advocate will respond to all patient complaint forms and address written complaints with patients on a weekly basis.  Documentation of the patient complaint forms with the outcome/resolution are available for review with the patient advocate.  Any employees who are confirmed to have violated patient rights will be referred to their immediate supervisor for coaching, retraining, and possible disciplinary actions, as necessary.
Staff have been retrained on caring for children. "
03/28/2024,748.1003(a) - Individual Standards Evaluated,Individual Standards Evaluated,No,05/02/2024,05/15/2024,Individual Standards Evaluated,Medium High,Yes,The operation was out of ratio during the day on at least 3 occurrences in 1-2 units.,Walk through was conducted. Staff interviewed. Ratio was found in compliance. Staff were retrained in April signed attendance forms.
03/28/2024,748.2307(9) - Individual Standards Evaluated,Individual Standards Evaluated,No,05/03/2024,06/20/2024,Individual Standards Evaluated,Medium High,Yes,3 staff and 1 child stated staff use profane language around and/or towards the children in care. ,"An email was received on 5.2.24 from the Administrator. Pt. Advocate will respond to all patient complaint forms and address written complaints with patients on a weekly basis.  Documentation of the patient complaint forms with the outcome/resolution are available for review with the patient advocate.  Any employees who are confirmed to have violated patient rights will be referred to their immediate supervisor for coaching, retraining, and possible disciplinary actions, as necessary.
Staff have been retrained on caring for children. "
03/11/2024,748.1003(a) - Individual Standards Evaluated,Individual Standards Evaluated,No,03/18/2024,03/21/2024,Individual Standards Evaluated,Medium High,Yes,Four of the Seven Units were observed out of ratio and a group was observed out of ratio while walking to dinner. ,Conducted unannounced inspections of the 4 units and they were found to be in compliance of ratio.  
02/16/2024,748.1101(b)(1)(B) - Individual Standards Evaluated,Individual Standards Evaluated,No,06/25/2024,06/20/2024,Individual Standards Evaluated,High,Yes,It was determined children were exposed to explicit content when a staff member screened their phone to the television.,An Inspection on 6/20/24 it was determined the staff was terminated and was no longer associated with the facility. 
02/09/2024,748.930(b)(1)(A) - Individual Standards Evaluated,Individual Standards Evaluated,No,06/05/2024,06/20/2024,Individual Standards Evaluated,Medium High,Yes,It was found the staff involved in this case had EBI training 7/27/23 which expired in January and did not have current training at the time of the incident. ,An Excel Spreadsheet has been created with all personnel and the due date for their next EBI training. 
02/09/2024,748.2455(a)(2) - Individual Standards Evaluated,Individual Standards Evaluated,No,06/05/2024,06/20/2024,Individual Standards Evaluated,Medium High,Yes,Documentation determined the victim was walking away from the situation when the staff  chose to restrain the child.,All staff were retrained on EBI.
02/09/2024,748.3351(1) - Individual Standards Evaluated,Individual Standards Evaluated,No,02/16/2024,02/27/2024,Individual Standards Evaluated,Medium High,Yes,It was noted during a walkthrough that multiple bathrooms had feces on the walls.  One room had a rotten food product in the sink.  Food smears were noted in multiple rooms.  ,Walk through was conducted of 4 of the Units and found to be in compliance.  
02/08/2024,748.685(c)(2) - Individual Standards Evaluated,Individual Standards Evaluated,No,02/22/2024,02/27/2024,Individual Standards Evaluated,High,Yes,Staff were iinterviewed and were unaware and unable to tell the protocol of knowing which staff would handle incidents and which would monitor the kids. ,Staff were interviewed and able to tell the protocol for ensuring children are supervised should an incident occurr. 
02/08/2024,748.151(3) - Individual Standards Evaluated,Individual Standards Evaluated,No,03/14/2024,03/21/2024,Individual Standards Evaluated,Medium,No,"Based on documentation and interviews with staff, it was determined that the operation is changing the staffing schedules and adding more staff and are providing licensing different schedules. ",Staff were interviewed regarding schedules and were found in compliance. 
02/08/2024,748.309 - Individual Standards Evaluated,Individual Standards Evaluated,No,03/14/2024,03/21/2024,Individual Standards Evaluated,Medium,No,"Through interviews with staff, it was determined that the operation is completing incident reports but are not making reports to the hotline. ",Spoke with staff and they were able to give the protocol for documenting and reporting Serious Incidents. 
02/08/2024,748.1003(a) - Individual Standards Evaluated,Individual Standards Evaluated,No,02/20/2024,02/27/2024,Individual Standards Evaluated,Medium High,No,"Through interviews, it was determined that two units were out of ratio having 20 residents with 2 staff and 11 residents with 2 staff. ",Walk through was completed and ratio was in compliance. 
