Citation Date,Standard Number / Description,Category,Corrected at Inspection,Correction Deadline Date,Date Correction Evaluated,Sections Violated,Standard Risk Level,Technical Assistance Given,Deficiency Narrative,Correction Narrative
07/24/2024,745.651(1) - Individual Standards Evaluated,Individual Standards Evaluated,Yes,08/07/2024,,Individual Standards Evaluated,Medium,No,"A staff member's background check is listed as active. The staff member was not associated with the operation since April 14, 2024.",
07/24/2024,748.431(b) - Individual Standards Evaluated,Individual Standards Evaluated,Yes,09/27/2024,,Individual Standards Evaluated,Medium Low,No,Records were purged and unavailable during the investigation. ,
03/27/2024,748.2203(c) - Medication,Medication,Yes,03/27/2024,,L:Medication,Medium High,Yes,One of the two children's medication did not have a document explaining the reason the medication was given on the wrong date. ,
03/27/2024,748.3301(a)(2) - Individual Standards Evaluated,Individual Standards Evaluated,No,04/05/2024,03/28/2024,Individual Standards Evaluated,Medium,Yes,"The air return vents located next to the dining area (hall) and the one located in the hall upstairs were covered with dust, as well as the ceiling in the Cowboys bedroom had dust on the ceiling as well as the ceiling fan. ","The operation submitted photos of the air return vents. The vents were clean. The agency has made the cleaning of the vents as part of the chore list, so that it will not be missed in the future."
04/11/2023,748.681(2) - Personnel,Personnel,No,04/27/2023,05/19/2023,E:Personnel,Medium,No,Two out of two employee files did not have verification of education. One of the employee verification was received at the time of inspection. ,"The operation hired another caregiver to take Latrina Hollands place. She will be able to come back to work after she receives the copy of her diploma. Skyline High School told them that the diploma could possibly be ready by the 5/24/23. The Administrator has tried the online services to get verification but its only for colleges. RCCR Inspector received email from Maureen stating that Skyline High School told the employee that they don't keep copies of diploma on file if they are over five years old. They were able to place it on order, but it could take anywhere from 3 to 6 weeks to get. "
08/09/2022,748.2307(9) - Individual Standards Evaluated,Individual Standards Evaluated,No,08/26/2022,08/26/2022,Individual Standards Evaluated,Medium High,Yes,3 out of 4 children interviewed stated that a caregiver uses profane language and threatened a child in care. ,"An email was received with the re-training for the staff member for verbal de-escalation and restraint techniques. A safety plan was received that will be in affect for 30 days for the staff member for increased supervision by staff supervisor, weekly progress check and the staff member will go through another re-training of handling youth with care. "
07/28/2022,748.3301(a)(2) - Individual Standards Evaluated,Individual Standards Evaluated,No,08/16/2022,08/16/2022,Individual Standards Evaluated,Medium,Yes,Restroom areas were observed to unclean and rust build up in toliets. ,A physical follow up to the operation was conducted by RCCR.  Mold in the showers had been removed and re-caulked. The bathrooms were observed to be clean. The rust in toilets' were removed and cleaned. 
07/28/2022,748.3301(a)(1) - Individual Standards Evaluated,Individual Standards Evaluated,No,10/17/2022,10/17/2022,Individual Standards Evaluated,High,Yes,The restroom areas were observed to have mold in both showers. ,"08/16/2022 A physical follow up to the operation was conducted by RCCR.  Mold in the showers had been removed and re-caulked. The bathrooms were observed to be clean. The rust in toilets' were removed and cleaned. However the showers continue to have what appears to be black mold or dirt on the tiles. +                                         10/17/2022 - pictures of the bathrooms new construction was received. The Eagles (downstairs) bathroom was completely gutted and replaced. The Cowboys upstairs shower had the grout and tile removed and replaced from the lower section of the shower. 
A further review of the bathrooms will be conducted November 7th during the semi-annual inspection.
Pictures of both bathrooms were placed in the CCL Digital storage."
06/29/2022,748.507(1) - Individual Standards Evaluated,Individual Standards Evaluated,No,01/12/2023,01/17/2023,Individual Standards Evaluated,Medium High,Yes,A caregiver did not use self-control or good judgement when he showed teenage boys in care inappropriate photos and videos.,"a. employee general responsibilities training for all AFC employees was conducted on 7/9/22 specifically reviewing the previous serious incident. 
b) All AFC employees were trained again on 7/9/22 on the use of cell phones at the facility. No employee cell phones are allowed to be used by residents. No employee shall use their cell phone or any other method to share non-educational or non-therapeutic content with children in care. 
c) ongoing- All new AFC employees are trained on our cell phone policy during orientation training. "
06/29/2022,748.1101(b)(1)(B) - Individual Standards Evaluated,Individual Standards Evaluated,No,01/12/2023,01/17/2023,Individual Standards Evaluated,High,Yes,A caregiver showed five children in care ages 15 through 16 inappropriate videos and photos. ,"The employee is no longer working at the operation. He quit on June 26, 2022.
a) All employees reviewed the Children's Rights document on 7/9/22 and we discussed how the previous serious incident would violate those rights and how this incident could have been avoided and will not happen again.
b) Ongoing- All new AFC employees are trained on Childre's Rights during orientation and pre-service training. "
06/29/2022,748.303(a)(3)(B) - Individual Standards Evaluated,Individual Standards Evaluated,No,01/12/2023,01/17/2023,Individual Standards Evaluated,Medium High,Yes,"Staff was informed June 26, 2022, that children in care were being given inappropriate material by a caregiver but did not report it to licensing until June 28, 2022.",Reporting serious incidents training for all AFC employees was conducted on 7/9/2022 reminding them what is considered to be a serious incident and the reporting timeline requirements. 
06/29/2022,745.619 - Individual Standards Evaluated,Individual Standards Evaluated,No,10/23/2023,10/23/2023,Individual Standards Evaluated,High,No,An out of state background check was not completed for a caregiver who moved to Texas March 2019 which is less than five years.,"The Administrator was informed on 1/10/2023 of the DFPS process for reviewing out of stated applicants and how out of state information for applicants that have lived outside of Texas less than five years must be included when submitting a background check. 
b) The Administrator is the person that enters the DFPS background check information and conducts a review of the minimum standards/tac on 1/10/2023. If the applicant has been in Texas less than five years, the applicants previous state will be included in the background request."
05/17/2022,748.303(a)(10)(A) - Reports and Record Keeping,Reports and Record Keeping,No,05/24/2022,05/19/2022,D:Reports and Record Keeping,Medium,No,during a review of children's medical file it was found that there were six children in care that tested positive for Covid-19 and it was not reported to the hotline and no seriious incident report was completed. ,Operation sent copies of the serious incident reports and have implemented a new process to include calling the hotline and DFPS. They will also generate serious incident reports for any positive covid-19.
05/17/2022,748.3301(a)(2) - Physical Site,Physical Site,No,05/24/2022,05/26/2022,P:Physical Site,Medium,No,The bathroom upstairs in the main house was missing the glass covering on the overhead light.,The operation submitted a picture of the bathroom light fixture with the new light fixture in place. They are also re-instating the maintenance list and will go over the process with staff to ensure that any repairs are placed on a to do list. 
