Citation Date,Standard Number / Description,Category,Corrected at Inspection,Correction Deadline Date,Date Correction Evaluated,Sections Violated,Standard Risk Level,Technical Assistance Given,Deficiency Narrative,Correction Narrative
09/09/2025,745.8411(b)(3) - Individual Standards Evaluated,Individual Standards Evaluated,No,09/12/2025,09/16/2025,Individual Standards Evaluated,High,Yes,Fiscal documentation related to the operations heightened monitoring plan was requested on 8/29/2025 and 9/3/2025 and not provided as of 9/9/2025.,
08/18/2025,748.1351 - Individual Standards Evaluated,Individual Standards Evaluated,No,09/03/2025,08/29/2025,Individual Standards Evaluated,Medium Low,Yes,A service plan did not have team member signatures and did not have a date of implementation. ,"Corrective Actions to immediately address the deficiencies:
Service Plan Correction (Completed August 29, 2025):
The plan for Daviyone was corrected to include accurate completion/implementation dates, verified child identifiers, and signature lines for all service team members.

Audit of All Current Service Plans (By September 2, 2025):
Case Management and QA staff are auditing all active youth service plans for missing dates, signatures, or errors.
Any discrepancies are being corrected, and corrected plans re-uploaded into Extended Reach.

Staff Retraining (By September 2, 2025):
Case managers and program staff involved in service planning are being retrained on §748.1351 requirements.
A Service Plan Checklist (newly implemented) must be used prior to finalizing each plan. This checklist requires verification of:
Completion date and implementation date.
All required signatures and dates.
Correct youth identifiers throughout the plan.
"
07/29/2025,748.2953(b) - Individual Standards Evaluated,Individual Standards Evaluated,No,08/07/2025,08/19/2025,Individual Standards Evaluated,Medium,Yes,Quarter 2 Emergency Behavior Intervention numbers were not submitted to licensing timely. ,"1.Tracking Enhancement:
Extended Reach calendar reminders have been updated to automatically flag upcoming EBI quarterly due dates 30 days and 7 days in advance.

A compliance tracking spreadsheet will also be maintained by the Executive Director as a secondary safeguard.

2.Staff Training:
All clinical and case management staff have been retrained on the requirement that all EBI reviews must be completed at least once every 90 days per youth.

Training emphasizes documentation requirements, clinical review content, and signature protocols.

Quarter 2 EBI numbers have been uploaded to CLASS. "
07/11/2025,748.1101(b)(4)(A)(v) - Individual Standards Evaluated,Individual Standards Evaluated,No,08/28/2025,09/16/2025,Individual Standards Evaluated,Medium High,Yes,Staff used inappropriate language to refer to a foster child's behavior. ,"Corrective Actions 
To immediately address this deficiency:

Staff Involved (Completed August 20, 2025):
The staff member was counseled and issued a corrective action notice.
Incident was documented in personnel records.

Training (To be completed by August 26, 2025):
All direct care staff are required to complete a refresher training on Respectful Communication and Trauma-Informed Care, including emphasis on §748.1101(b)(4)(A)(v).

Follow up inspection conducted on 9/16/25. See inspection id #4075961.
"
06/30/2025,748.399(a) - Individual Standards Evaluated,Individual Standards Evaluated,No,08/29/2025,08/29/2025,Individual Standards Evaluated,Medium,Yes,Documentation pertaining to the investigations were requested on multiple occasions and never received in a timely manner. ,"Training (Scheduled for August 30, 2025):

Case managers, direct care supervisors, and administrative staff will complete a refresher training on Documentation Standards and Compliance with §748.399(a).
"
06/11/2025,748.2853(2) - Emergency Behavior Intervention,Emergency Behavior Intervention,No,06/17/2025,07/08/2025,N:Emergency Behavior Intervention,Medium Low,Yes,An Emergency Behavior Intervention report was reviewed and there was no documentation that a discussion with the foster child was attempted. ,The operation has not had a second EBI since the first EBI report. The operation has added a segment to their online form for employees to include whether a post-EBI discussion has occurred. 
05/02/2025,748.3445(a) - Individual Standards Evaluated,Individual Standards Evaluated,No,05/07/2025,05/29/2025,Individual Standards Evaluated,Medium High,No,"During Walkthrough Inspection, expired food were found in th e freezer and fridge","During walkthrough, no expired foods or items were observed. Multiple freeze-by dates were noted to be compliant. "
05/02/2025,748.3301(a)(1) - Individual Standards Evaluated,Individual Standards Evaluated,No,05/18/2025,05/29/2025,Individual Standards Evaluated,High,No,"During walkthrough, the operation had several holes in the wall due to an altercation that occured recently","A walkthrough of the home was completed, and all holes were noted to be completely covered. "
05/02/2025,748.1703(a) - Individual Standards Evaluated,Individual Standards Evaluated,No,05/11/2025,05/29/2025,Individual Standards Evaluated,Low,No,"During walkthrough, there were no menus posted for the operation.","During walkthrough, I asked staff to show me the May calendar for food. The calendar was observed to be compliant with standards. "
04/28/2025,748.863(a)(3) - Individual Standards Evaluated,Individual Standards Evaluated,No,05/05/2025,06/03/2025,Individual Standards Evaluated,Medium High,Yes,A direct care staff did not have pre-service emergency behavior intervention training. ,The direct care staff observed during the inspection was compliant with EBI training requirements. Operation understands that caregivers are not in ratio without 4 hours.
01/15/2025,748.303(a)(7)(B) - Individual Standards Evaluated,Individual Standards Evaluated,No,01/22/2025,,Individual Standards Evaluated,Medium,No,Compliance plan to mitigate risk has not been submitted for this citation. Operation did not notify CVS worker of a citation provided to a child in care.,
01/15/2025,748.1337(b)(2)(B) - Individual Standards Evaluated,Individual Standards Evaluated,No,01/22/2025,,Individual Standards Evaluated,Medium Low,No,Compliance plan to mitigate risk has not been submitted for this citation. A child in care's service plan does not have a description for how the operation will address treatment. ,
11/14/2024,748.303(a)(7)(B) - Individual Standards Evaluated,Individual Standards Evaluated,No,12/20/2024,,Individual Standards Evaluated,Medium,No,Operation did not notify CVS worker of a citation provided to a child in care.,
11/14/2024,748.1337(b)(2)(B) - Individual Standards Evaluated,Individual Standards Evaluated,No,12/20/2024,,Individual Standards Evaluated,Medium Low,Yes,A child in care's service plan does not have a description for how the operation will address treatment. ,
11/06/2024,748.3421(3) - Individual Standards Evaluated,Individual Standards Evaluated,Yes,12/13/2024,,Individual Standards Evaluated,Medium High,No,,
11/04/2024,748.3105(b) - Safety and Emergency Practices,Safety and Emergency Practices,No,12/04/2024,03/06/2025,O:Safety and Emergency Practices,Medium High,Yes,An inspection of the operation was completed. The operation did not provide documentation on how the home complies with this standard. ,The operation provided documentation of completed Fire Inspections. Both homes were inspected on 1/24/2025 and both homes passed. The Fire Inspection documentation will be uploaded to the document library. 
10/09/2024,748.3105(b) - Individual Standards Evaluated,Individual Standards Evaluated,No,10/16/2024,11/04/2024,Individual Standards Evaluated,Medium High,Yes,An inspection of the operation was completed. The operation did not provide documentation on how the home complies with this standard. ,
09/13/2024,748.3105(b) - Individual Standards Evaluated,Individual Standards Evaluated,No,09/20/2024,10/09/2024,Individual Standards Evaluated,Medium High,Yes,"On 7/19/2024, a fire inspection was completed with the following concerns: 
1. Check electrical permit for service to storage building- will check during R-4 inspection
Media closet door not accessible- complete
Occupant of the home must verify fire alarm coverage, have current codes and be the contact for alarm company.
2. Fire alarm is scheduled to be inspected the week of July 22-26.
Note for future R-4 occupancy use:
Fire alarm/ Sprinkler system will need to be upgraded to R-4 requirements if housing more than 5 residents. Sprinkler and fire
alarm plans will need to be submitted to the town for R-4 occupancy.

An extension will be provided until 9/20/2024 to allow the operation to obtain a fire inspection without corrections. ",
07/19/2024,748.1337(b)(1)(A)(i) - Individual Standards Evaluated,Individual Standards Evaluated,No,09/25/2024,10/17/2024,Individual Standards Evaluated,Medium Low,Yes,A child's Initial Service Plan did not document plans to meet their medical needs.,"RCCR received documentation to support medical plans are included in a child's service plan such as a plan for medical, dental, hearing and TB exams. "
07/19/2024,748.1349(b)(2) - Individual Standards Evaluated,Individual Standards Evaluated,No,09/25/2024,10/17/2024,Individual Standards Evaluated,Low,Yes,"An Initial Service Plan was not signed by the child, and there was no documentation of a refusal.",RCCR received documentation to support a initial signed service plan by the child. 
07/19/2024,748.1331(a) - Individual Standards Evaluated,Individual Standards Evaluated,No,09/25/2024,10/17/2024,Individual Standards Evaluated,Medium Low,Yes,A Preliminary Service Plan did not address immediate supervision needs. ,RCCR received documentation to support supervision needs were included in a child's preliminary service plan by stating the child will have 1:2 supervision ratio.
07/03/2024,748.3001(a) - Individual Standards Evaluated,Individual Standards Evaluated,No,07/10/2024,07/08/2024,Individual Standards Evaluated,Medium High,Yes,Health Inspection was not completed at the operation's new location. ,RCCR received documentation via email to support a sanitation health inspection was completed at the operation on 7/5/2024.
07/03/2024,748.3105(b) - Individual Standards Evaluated,Individual Standards Evaluated,No,09/13/2024,09/13/2024,Individual Standards Evaluated,Medium High,Yes,"On 06/28/2024 a fire inspection was performed.  3 violations were noted, and the inspection failed due to 1. not having 7 or fewer children, 2. access to water heater blocked. 3. fire extinguishers are not mounted 4. fire escape plan not written 5. electric systems not in good condition 6. garage storage is not in compliance. ",
03/12/2024,748.3603(d) - Individual Standards Evaluated,Individual Standards Evaluated,No,03/26/2024,04/15/2024,Individual Standards Evaluated,High,No,The operation's pool is not enclosed.,Operation has a 6ft fence enclosing the pool. There are sand bags holding the fence down on the inside/outisde of fence and a lock on the fence to prevent access to the pool. 
03/12/2024,748.3603(j) - Individual Standards Evaluated,Individual Standards Evaluated,No,03/26/2024,03/15/2024,Individual Standards Evaluated,High,No,The door leading to the pool from the dining room can be opened by a teen and the sensor was not on.,The operation provided a documentation from the fire department stating the back exit door can not have a lock or be blocked.
03/12/2024,748.3603(i) - Individual Standards Evaluated,Individual Standards Evaluated,No,03/26/2024,03/25/2024,Individual Standards Evaluated,Medium High,No,This standard was not in compliance during the inspection.,The operation has purchased a 6ft fence and it is currently installed. 
03/12/2024,748.3101(2) - Individual Standards Evaluated,Individual Standards Evaluated,No,04/02/2024,03/25/2024,Individual Standards Evaluated,Medium High,Yes,"Documentation was received to support a fire inspection was requested, however the fire inspections are delayed per the fire department. ",The operation received a fire inspection. Fire inspection documentation was received. 
03/02/2024,748.3061(2) - Safety and Emergency Practices,Safety and Emergency Practices,No,03/16/2024,03/12/2024,O:Safety and Emergency Practices,Medium High,No,The inspection form was not provided upon inspection.,"A gas inspection was completed on March 5, 2024. At that time a gas leak was identified and an estimate to correct the leak was provided. "
03/02/2024,748.3603(d) - Physical Site,Physical Site,No,03/04/2024,03/12/2024,P:Physical Site,High,Yes,The operation's pool is not enclosed.,
03/02/2024,748.3603(i) - Physical Site,Physical Site,No,03/04/2024,03/12/2024,P:Physical Site,Medium High,No,This standard was not in compliance during the inspection.,
03/02/2024,748.3101(2) - Safety and Emergency Practices,Safety and Emergency Practices,No,03/04/2024,03/12/2024,O:Safety and Emergency Practices,Medium High,No,The inspection form was not provided upon inspection.,
03/02/2024,748.3603(j) - Physical Site,Physical Site,No,03/04/2024,03/12/2024,P:Physical Site,High,Yes,The door leading to the pool from the dining room can be opened by a teen and the sensor was not on.,
02/04/2024,748.949(b)(5) - Individual Standards Evaluated,Individual Standards Evaluated,No,04/12/2024,04/15/2024,Individual Standards Evaluated,Medium Low,Yes,The certificate for EBI training does not document the training hours.,"A compliance plan was not received by the compliance date. An email was sent to the administrator to send compliance plan by the end of the day, 4/15/2024. The operation sent updated EBI record with training hours."
02/04/2024,748.1205(a)(10) - Individual Standards Evaluated,Individual Standards Evaluated,No,04/12/2024,04/15/2024,Individual Standards Evaluated,Medium High,Yes,The admission assessment does not document the known contraindications for the child in care. ,"A compliance plan was not received by the compliance date. An email was sent to the administrator to send compliance plan by the end of the day, 4/15/2024. The operation submitted documentation with ""N/A"" listed for known contraindications."
02/03/2024,748.2003(b)(3) - Individual Standards Evaluated,Individual Standards Evaluated,Yes,05/16/2024,,Individual Standards Evaluated,Medium High,Yes,A child in care did not receive medication as instructed for 2 days. ,
01/17/2024,748.3603(d) - Individual Standards Evaluated,Individual Standards Evaluated,No,02/07/2024,03/02/2024,Individual Standards Evaluated,High,No,The operation's pool is not enclosed by a 6 ft fence.,
01/17/2024,748.3603(i) - Individual Standards Evaluated,Individual Standards Evaluated,No,02/07/2024,03/02/2024,Individual Standards Evaluated,Medium High,No,The swimming pool fence has slats towards the opposite side of the pool.,
01/17/2024,748.3101(2) - Individual Standards Evaluated,Individual Standards Evaluated,No,02/07/2024,03/02/2024,Individual Standards Evaluated,Medium High,Yes,Last approved fire inspection was June 2022.,
12/27/2023,748.3603(i) - Individual Standards Evaluated,Individual Standards Evaluated,No,01/10/2024,01/17/2024,Individual Standards Evaluated,Medium High,No,The swimming pool fence has slats towards the opposite side of the pool.,
12/27/2023,748.3061(2) - Individual Standards Evaluated,Individual Standards Evaluated,No,01/10/2024,03/02/2024,Individual Standards Evaluated,Medium High,No,Last approved gas inspection was  04/23/2021.,
12/27/2023,748.3603(d) - Individual Standards Evaluated,Individual Standards Evaluated,No,01/10/2024,01/17/2024,Individual Standards Evaluated,High,No,The operation's pool is not enclosed by a 6 ft fence.,
12/27/2023,748.3101(2) - Individual Standards Evaluated,Individual Standards Evaluated,No,01/10/2024,01/17/2024,Individual Standards Evaluated,Medium High,No,Last approved fire inspection was June 2022.,
12/21/2023,748.3301(a)(3) - Individual Standards Evaluated,Individual Standards Evaluated,No,12/28/2023,01/17/2024,Individual Standards Evaluated,High,Yes,"During inspection, an outlet was found to be missing a cover in the closet located in youth bedroom two. ",During a follow up inspection the light outlet in bedroom 2 was observed to be covered. 
12/21/2023,748.3443(b)(2) - Individual Standards Evaluated,Individual Standards Evaluated,No,12/28/2023,01/17/2024,Individual Standards Evaluated,Medium,No,"During a walkthough of the operation, the freezer was found to be missing a thermometer. ",Thermometer was observed in freezer.
12/12/2023,748.399(a) - Individual Standards Evaluated,Individual Standards Evaluated,No,02/14/2024,04/04/2024,Individual Standards Evaluated,Medium,Yes,"During the investigation, medication logs for a child were requested from the operation on 2/2/2024 and were not provided. ",The operation sent the requested medication logs via email. 
12/12/2023,748.1437(5) - Individual Standards Evaluated,Individual Standards Evaluated,No,02/14/2024,03/02/2024,Individual Standards Evaluated,Medium,Yes,"During the investigation, it was determined that a child in care's discharge medication information was missing information on the reason the medication was prescribed and the dosage of the medication. ",This standard was found compliant.
12/12/2023,748.2101(8) - Individual Standards Evaluated,Individual Standards Evaluated,No,02/14/2024,03/02/2024,Individual Standards Evaluated,Medium,Yes,"During the investigation, it was determined that there were two children discharged from the facility who currently had their medications present at MiOwn home. ",This standard was compliant at inspection.
10/27/2023,748.153(3)(A) - Individual Standards Evaluated,Individual Standards Evaluated,No,11/27/2023,10/20/2023,Individual Standards Evaluated,Medium High,Yes,The operation does not have an Administrator. ,Regulations verified through the internal portal that the assigned administrator completed the exam on 10/20/23. 
08/31/2023,748.153(3)(A) - Individual Standards Evaluated,Individual Standards Evaluated,No,09/15/2023,09/15/2023,Individual Standards Evaluated,Medium High,Yes,Administrator position is vacant. ,A person was hired to fill the position. 
07/12/2023,748.3603(d) - Individual Standards Evaluated,Individual Standards Evaluated,No,09/15/2023,12/27/2023,Individual Standards Evaluated,High,Yes,The operation's pool is not enclosed by a 6 ft fence.,
07/12/2023,748.363(6) - Reports and Record Keeping,Reports and Record Keeping,No,07/19/2023,,D:Reports and Record Keeping,Medium,No,2 of 2 staff files did not have Licensing Affidavit for Applicants for Employment form.,
07/12/2023,748.3603(e) - Individual Standards Evaluated,Individual Standards Evaluated,No,09/15/2023,09/27/2023,Individual Standards Evaluated,High,Yes,Child bedroom has a door that leads to outdoor pool.,"The owner communicated via email the operation is looking for quotes for to add a pool fence. The compliance date has been updated to 8/15/2023. During an inspection on 9/27/23 RCCR observed the bedroom leading to the pool is no longer being used as a bedroom. The room is currently being used as storage. 

Contact was made with R.Wyatt on 8/31/2023. Due to a lack of notification or updates pertaining to the installation of pool fence the operation was recited. During the contact it was discussed that a new compliance date will be issued to ensure the operation has mitigated risk. Compliance date is set for 9/15/2023.

A follow up inspection was completed on 9/27/23. During the inspection RCCR observed the bedroom with access to the pool as being locked. The operation has removed all children from the room. The room is currently being used as clothing storage."
05/30/2023,748.3603(i) - Individual Standards Evaluated,Individual Standards Evaluated,No,08/02/2023,03/02/2024,Individual Standards Evaluated,Medium High,Yes,"The fence surrounding the pool is not 
in compliance. The slats are facing 
outside of the property.",
07/07/2022,748.2101(1) - Individual Standards Evaluated,Individual Standards Evaluated,Yes,08/15/2022,,Individual Standards Evaluated,High,Yes,There was prescription medication not locked up and assessable to children.  It was locked up at inspection. ,
07/07/2022,748.2051(3) - Individual Standards Evaluated,Individual Standards Evaluated,No,09/16/2022,02/09/2023,Individual Standards Evaluated,Medium High,Yes,The documentation from the child's doctor that was provided expired in 07/16/2020 and the other form that was also provided was dated on 08/22/2022.  ,A compliance plan was received from Rachel Wyatt via email. In regard to standard 748.2051(3) Case Managers and LCCA at MIOWN HOME will ensure that all documentation will be updated monthly during the audit of clients records. 
07/07/2022,748.2051(2) - Individual Standards Evaluated,Individual Standards Evaluated,No,09/16/2022,02/09/2023,Individual Standards Evaluated,Medium,Yes,The service plan did not address the requirements for a child that self medicates.,A compliance plan was received from Rachel Wyatt via email. In regard to standard 748.2051(2) Case Managers and LCCA at MIOWN HOME will ensure the administration of self-medication is provide in the service plan for each clients files that qualify. 
05/18/2022,748.399(a) - Individual Standards Evaluated,Individual Standards Evaluated,No,07/06/2022,07/06/2022,Individual Standards Evaluated,Medium,No,Copy of the unauthorized absence annual log was requested but never received. Multiple requests were made via phone call and emails. ,The operation submitted a copy of the annual review log.
05/13/2022,748.309 - Individual Standards Evaluated,Individual Standards Evaluated,No,06/10/2022,06/10/2022,Individual Standards Evaluated,Medium,Yes,Operation failed to notify Statewide Intake about this incident until four days after the incident had occurred. ,"Please Note: RCCR Inspector, is not requiring follow up as this deficiency is a result of the director failing to follow her own policy that she has instituted at the operation to contact Statewide Intake regarding any serious incidents. Staff at the operation has been trained to call in serious incidents. Director failed to follow proper protocol in reporting incident. "
05/12/2022,748.151(1) - Individual Standards Evaluated,Individual Standards Evaluated,No,06/06/2022,06/06/2022,Individual Standards Evaluated,Medium,Yes,MiOwn home notified that the Administrator's position was vacant on 12/31/21. On 03/09/2022 a deficiency for the Administrator vacancy was issued. 30 days was provided to obtain compliance. On 04/06/2022 the operation submitted a variance for standard number 748.533(a)(5). On 05/05/2022 the variance was denied. The operation has not obtained an Administrator.  ,Operation has new administrator who meets required qualifications. Administrator has been added to controlling person list and is listed in CLASS as active administrator. Administrator will start on 06/06/2022
04/07/2022,745.4151(c)(4)(A) - Individual Standards Evaluated,Individual Standards Evaluated,No,04/14/2022,04/14/2022,Individual Standards Evaluated,High,Yes,A review of an employee file showed that file did not have required mandatory drug screening. ,Operation provided a copy of required Drug Screening to bring employee into compliance with required standard
04/07/2022,748.363(5) - Individual Standards Evaluated,Individual Standards Evaluated,No,04/14/2022,04/14/2022,Individual Standards Evaluated,Medium,Yes,A review of an employee file did not have a cleared tuberculosis screening,Operation provided a copy of required TB Screening to bring employee in compliance with Standard
03/09/2022,748.151(1) - Individual Standards Evaluated,Individual Standards Evaluated,No,04/09/2022,05/12/2022,Individual Standards Evaluated,Medium,Yes,MiOwn home notified that their Administrator's position was vacant on 12/31/21.,
01/24/2022,745.4151(c)(4)(A) - Individual Standards Evaluated,Individual Standards Evaluated,No,01/28/2022,01/27/2022,Individual Standards Evaluated,High,Yes,"During a review of an employee file, it was discovered that a contract employee who was then subsequently hired as a regular employee failed to have a required drug test prior to starting to work at the operation",Operation submitted drug test results for employee to meet compliance. 
12/07/2021,HRC42.063(a) - Individual Standards Evaluated,Individual Standards Evaluated,No,01/20/2022,01/18/2022,Individual Standards Evaluated,High,Yes,During an investigation at your operation it was discovered that a resident was able to get on the roof and no incident report was documented by your operation as required. ,Follow-up by RCCR Inspector was completed on 1/24/22.  The operation provided signed in sheets as well to verify that they went over reporting incident.  The operation has a policy in place for reporting incidents and forwarded the policy to licensing.  The operation stated that they went over reporting requirements with all staff. All room were moved to the first floor of the facilty
11/19/2021,748.2051(3) - Medication,Medication,No,12/10/2021,12/10/2021,L:Medication,Medium High,Yes,A review of medication indicated that a child in care is able to administer his own medication and keep the medication with him at all times. Documentation from a medical provider is needed,Operation submitted updated policy to ensure that any youth who has to take self administered medication will have documentation prior from a health care provider as well as documentation in child file. The child associated to this deficiency was discharge. 
