Citation Date,Standard Number / Description,Category,Corrected at Inspection,Correction Deadline Date,Date Correction Evaluated,Sections Violated,Standard Risk Level,Technical Assistance Given,Deficiency Narrative,Correction Narrative
11/19/2021,748.2851(b) - Emergency Behavior Intervention,Emergency Behavior Intervention,No,12/03/2021,12/06/2021,N:Emergency Behavior Intervention,Medium,Yes,A review of a EBI incident at the operation did not show documentation of a post discussion with child care staff,Operation submitted revised report showing that the post discussing required did not take place due to the OV being placed in police custody. 
11/19/2021,748.2855(a)(6) - Emergency Behavior Intervention,Emergency Behavior Intervention,No,12/03/2021,12/06/2021,N:Emergency Behavior Intervention,Medium,Yes,A review of a child file were EBI was administered did not record the length of time child was in the restraint,Operation submitted updated EBI report outlining the length of time child was in restraint
07/08/2021,748.103(b)(7) - Organization and Administration,Organization and Administration,No,07/22/2021,08/09/2021,C:Organization and Administration,Medium,Yes,The discipline procedures does not prohibit the use of threatening corporal punishment.  ,"Updates were included to add a.	Staff may never use or threaten to use corporal punishment with any youth in care. Corporal punishment is the infliction of physical pain on any part of a 
youths body as a means of controlling or managing the youths behavior."
07/08/2021,748.115(4) - Organization and Administration,Organization and Administration,No,07/22/2021,08/09/2021,C:Organization and Administration,Medium,No,This standards is not addressed in the policies and procedures. ,"Updates were made to state that: h.	In order to avoid escalating situations in which disciplinary measures have to be taken, it is important for staff to nurture and stimulate the youth in care and promptly respond to and meet their needs. Youth who are stimulated by a structured and organized environment, and are encourages and supported, are less likely to engage in behaviors that require consequences.
i.	To create a nurturing environment, staff should: always be present, both verbally and non-verbally, in each interaction with a child; provide comfort and support when/if needed and in a timely manner; provide a safe physical, mental, and social environment; and promote healthy boundaries and relationships with peers and adults. j.To provide stimulation, it is important for staff to follow the program schedule at all times. This allows youth to develop a routine and provides a structured, organized environment to allow the youth to thrive. The program schedule also provides youth with ample opportunities for activity and stimulation on a daily basis. 
"
07/08/2021,748.903(c)(9) - Training and Professional Development,Training and Professional Development,No,07/22/2021,08/09/2021,F:Training and Professional Development,Medium High,Yes,EBI ciriculum was submitted. There were no visual representation of the holds. ,The operation submitted photographs of EBI techniques which will be used at the operation. All are in compliance with standards. 
07/08/2021,745.903(1) - Individual Standards Evaluated,Individual Standards Evaluated,No,07/22/2021,08/09/2021,Individual Standards Evaluated,High,Yes,The Administrator will require a controlling person's form. ,The operation submitted appropriate controlling persons forms.
07/08/2021,745.243 - Individual Standards Evaluated,Individual Standards Evaluated,Yes,07/08/2021,,Individual Standards Evaluated,High,No,The application states that protective and supportive devices will be used. It was explained that this is not being offered as a part of the restraint process. ,
07/08/2021,748.107(1) - Organization and Administration,Organization and Administration,No,07/22/2021,08/09/2021,C:Organization and Administration,Medium,No,The policy has a statement for youth served but does not have a policy for conflict of interest for childrens families found on page 14.,"Policies were updated to state that I.	All employees (and owners, contractors and volunteers, if applicable) are prohibited from having contact or any form of relationship with a youth and/or their family outside of their scope of responsibilities at MiOWN Home, including when a youth is no longer in our care. 
a.   Staff are prohibited from doing personal favors for youth and/or their families.
b.   If a staff member knows a youth and/or their family or has a pre-existing       personal relationship with the youth and/or their family prior to the youth and       familys involvement with MiOWN Home, the employee must immediately disclose this information so that the appropriate steps can be 
taken to mitigate a potential conflict of interest or the appearance of a conflict of interest. This notification must be in writing to the child care administrator. 
"
07/08/2021,748.101(1) - Organization and Administration,Organization and Administration,No,07/22/2021,08/09/2021,C:Organization and Administration,Low,Yes,The operation plan does not include names for the governing body members. ,Updates were included to add the governing body's names and it corresponds with the controlling persons forms submitted. 
07/08/2021,748.101(2)(B) - Organization and Administration,Organization and Administration,No,07/22/2021,08/09/2021,C:Organization and Administration,Medium,No,The purpose of this rule is to ensure that your operation is financially in the position to care for children without immediate reimbursements. Documentation to support adequate funds was last generated 02/2021. It is recommended that statements represent the most current statement period. ,The operation submitted an updated budget and verification of funds. 
07/08/2021,748.3105(b) - Safety and Emergency Practices,Safety and Emergency Practices,No,07/22/2021,07/09/2021,O:Safety and Emergency Practices,Medium High,Yes,The fire inspection documents violations that require corrections. It also indicates that the inspection was completed for a foster home. ,An approved fire inspection was completed on 07/09/2021.
07/08/2021,748.1111(a)(2) - Children's Rights,Children's Rights,No,07/22/2021,08/09/2021,H:Children's Rights,Medium,Yes,The policies and procedure documented on page 29 state that a child's phone calls may be screened with a notification only. ,"Policies were updated to include: a.	Youth may make phone calls to their families and friends on a regular basis. 
i.	Phone calls made by youth to their families and friends will last for a standard determination of time to ensure all youth in care have the opportunity to make calls. 
ii.	Some limitations may be placed on the frequency and duration of family telephone calls in order to allow for fair use of the telephone by all youth in the program.
iii.	If a family situation requires more frequent contacts, the case manager or designee, facilitates the contacts.
b.	In order to verify approved contacts, and update families on the youths progress, each phone call begins and ends with staff speaking to the party the youth has called. Staff members do not listen to telephone conversations (please see the policy titled Child Rights for further information).
"
07/08/2021,748.105(3)(C) - Organization and Administration,Organization and Administration,No,07/22/2021,08/09/2021,C:Organization and Administration,Medium,Yes,The Administrator does not live in the area. The Administrator will be present 30 hours a week. The staffing plan should support how this will be accomplished. ,"The staffing plan was updated to explain how the rule will be met, by 3 days a week, 10 hours a day. It is in compliance with standards. "
07/08/2021,748.3601(1) - Physical Site,Physical Site,No,07/22/2021,08/18/2021,P:Physical Site,High,Yes,The operation has 1 life saving device. An additional one should be purchased. ,The operation submitted receipts and photographs of a rescue pole. 
