Citation Date,Standard Number / Description,Category,Corrected at Inspection,Correction Deadline Date,Date Correction Evaluated,Sections Violated,Standard Risk Level,Technical Assistance Given,Deficiency Narrative,Correction Narrative
09/09/2022,748.1337(b)(1)(N) - Individual Standards Evaluated,Individual Standards Evaluated,No,09/28/2022,09/29/2022,Individual Standards Evaluated,Low,Yes,"Upon review of the initial service plan, it was discovered there are not signatures of the service planning team members that were involved in the development of the service plan."," Case managers have been trained on the importance of signatures of all 
participants on Service Plans. The Case Manager Supervisor will ensure all components of 
Service Plans will be completed prior to approval."
09/09/2022,748.1337(b)(1)(K) - Individual Standards Evaluated,Individual Standards Evaluated,No,09/28/2022,09/29/2022,Individual Standards Evaluated,Low,Yes,"Upon review of the initial plan of service, it was discovered there is no identification of all that participated in the development of the plan, nor are there signatures or dates on it."," Case managers have been trained on the importance of documenting all 
participants involved in the Service Plans. The Case Manager Supervisor will ensure all 
components of Service Plans will be completed prior to approval."
09/07/2022,748.303(a)(3)(B) - Individual Standards Evaluated,Individual Standards Evaluated,No,11/04/2022,11/04/2022,Individual Standards Evaluated,Medium High,Yes,Operation staff indicated a child in care's claim of being sexually active with an adult while on runaway status was not reported to the DFPS hotline.,Staff were spoken to regarding the standard and to contact DFPS for all suspicions of abuse/neglect and reviewed Boysvilles policy.
08/31/2022,748.1661(b) - Individual Standards Evaluated,Individual Standards Evaluated,No,10/03/2022,09/28/2022,Individual Standards Evaluated,Medium High,Yes,All five residents interviewed stated that they saw or were present when staff smoked in the facility.,Staff was placed on a 4-day unpaid suspension with a written warning. A drug test was completed on staff and they will be subjected to random UA's. Staff was also trained on policies/licensing standards and expectations.
08/31/2022,748.1661(d) - Individual Standards Evaluated,Individual Standards Evaluated,No,10/03/2022,09/28/2022,Individual Standards Evaluated,Medium High,Yes,All five residents stated that staff smoked while transporting resident in the vehicle.,Staff was placed on a 4-day unpaid suspension with a written warning. A drug test was completed on staff and they will be subjected to random UA's. Staff was also trained on policies/licensing standards and expectations.
08/26/2022,748.2101(2) - Individual Standards Evaluated,Individual Standards Evaluated,No,10/21/2022,10/21/2022,Individual Standards Evaluated,High,Yes,Child in care obtained access to staff operation keys and was able to gain access to the locked medication closet within the cottage during an incident.,Email sent from agency to Inspector stating staff have been trained to ensure the medication closet key is in their possession at all times and inaccessible to children. Staff member involved was terminated on 08/26/2022. Operation is not requesting an AR.
08/26/2022,748.2307(9) - Individual Standards Evaluated,Individual Standards Evaluated,No,10/21/2022,10/21/2022,Individual Standards Evaluated,Medium High,Yes,"Child in care was subjected to profane language by staff during an incident, while other children in care witnessed this behavior. ",Operation emailed Inspector stating staff member involved was terminated on 08/26/2022. All staff are trained to use appropriate language toward and around children in care. Staff are trained to not use profanity around all children. Operation stated they will not be AR'ing this citation.
08/17/2022,748.2003(b)(10) - Individual Standards Evaluated,Individual Standards Evaluated,No,09/27/2022,10/11/2022,Individual Standards Evaluated,Medium High,Yes,Child in care was administered a medication by staff that was prescribed to another child in care. ,Child in care was administered a medication by staff that was prescribed to another child in care. 
07/08/2022,748.4041 - Individual Standards Evaluated,Individual Standards Evaluated,No,08/10/2022,08/10/2022,Individual Standards Evaluated,High,Yes,A child in care was not properly restrained in his car seat while being transported in a vehicle. ,"The operation provided a follow-up to the deficiency stating that vehicle safety training was completed with all staff on July 20,2022. Additional car seat safety training will be completed for all staff before August 30, 2022. "
07/08/2022,748.507(1) - Individual Standards Evaluated,Individual Standards Evaluated,No,08/10/2022,08/10/2022,Individual Standards Evaluated,Medium High,Yes,It was confirmed that staff members took children in care  on an unauthorized trip away from the operation. Staff allowed an unapproved individual to have access to the children. ,The operation provided a follow-up to the deficiency stating that staffing was completed with all staff to discuss policy regarding trips away from the campus. This was completed on 07/09/2022. 
07/08/2022,748.685(a)(4) - Individual Standards Evaluated,Individual Standards Evaluated,No,08/10/2022,08/10/2022,Individual Standards Evaluated,High,Yes,Three children in care were allowed to go into a store without supervision from caregivers. ,The operation provided a follow-up to the deficiency stating that supervision practices and policies will be reviewed with all staff in the month of August 2022. 
07/08/2022,748.2307(8) - Individual Standards Evaluated,Individual Standards Evaluated,No,08/10/2022,08/10/2022,Individual Standards Evaluated,Medium High,Yes,Staff members will regularly yell at children in care when they are misbehaving. ,The operation provided a follow-up to the deficiency stating that consultation was completed with the staff member in question and feedback was provided. Follow-ups will be completed with staff member during supervision. 
05/20/2022,748.309 - Individual Standards Evaluated,Individual Standards Evaluated,No,08/15/2022,08/15/2022,Individual Standards Evaluated,Medium,Yes,Incident at operation was not reported to licensing as required. ,All case management staff have been informed of all policy and procedures regarding notifying licensing. The Compliance Director is overseeing case management to ensure all incoming case management is aware of Boysvilles expectations.
05/20/2022,748.685(c)(5) - Individual Standards Evaluated,Individual Standards Evaluated,No,08/15/2022,08/15/2022,Individual Standards Evaluated,Medium High,Yes,Communication between staff was inefficient to ensure children in care were provided the level of supervision needed at night. ,Boysville will ensure more communication between case managers between programs occurs. Case managers will meet with the previous program to ensure all pertinent information is obtained and followed through.
02/10/2022,748.3301(a) - Individual Standards Evaluated,Individual Standards Evaluated,No,02/24/2022,03/04/2022,Individual Standards Evaluated,High,Yes,Observed 3 out of 8 bathrooms contained mold in the shower. ,Observed 3 out of 8 bathrooms contained mold in the shower. 
10/13/2021,748.3365(a) - Individual Standards Evaluated,Individual Standards Evaluated,No,11/17/2021,11/22/2021,Individual Standards Evaluated,Medium,Yes,Child in care was not in own bed at night for sleeping. ,"November 17, 2021
Boysville has completed the compliance plan in reference to the findings on investigation. 
Standard 748.3365(a) Bedding must provide each child with an individual bed or bunk bed in childs room that elevates mattress off floor, or crib as appropriate. 
A child in care was not in their own bed at night for sleeping. 
Due to staffing issues our girls cottage were combined for the overnight shift. One residents refused to sleep in her assigned room, stating she was sleeping on the floor of another residents room. She later stated she did end up sleeping in the same bed as the other resident. 
The child care staff that was on duty that evening, was spoken with and given more detailed instructions on what to do if a child in care refuses request that could hinder protocol. Training over minimum standards  were reviewed with the staff to ensure her knowledge of guidelines that should be followed. 
"
02/20/2021,748.1101(b)(1)(B) - Individual Standards Evaluated,Individual Standards Evaluated,No,04/08/2021,04/07/2021,Individual Standards Evaluated,High,Yes,"Evidence and information gathered support that staff put child in care at risk of harm by using an inappropriate and unwarranted restraint. Furthermore, staff admitted to grabbing child in care by the child's hoodie and placing child in a headlock. ","Operation followed up with staff, where staff admitted to improper restraint.  Staff was then terminated immediately after incident.  EBI was taken by staff member prior to incident. "
02/20/2021,748.2551(a) - Individual Standards Evaluated,Individual Standards Evaluated,No,04/08/2021,04/07/2021,Individual Standards Evaluated,Medium High,Yes,Restraint was used on a child in care prior to using other de-escalation techniques such as verbal redirection. ,"Operation followed up with staff, where staff admitted to improper restraint.  Staff was then terminated immediately after incident.  EBI was taken by staff member prior to incident. "
02/20/2021,748.2551(c)(2) - Individual Standards Evaluated,Individual Standards Evaluated,No,04/08/2021,04/07/2021,Individual Standards Evaluated,High,Yes,Staff member used excessive force during a restraint with a child in care causing the child to have difficulty breathing. ,"Operation followed up with staff, where staff admitted to improper restraint.  Staff was then terminated immediately after incident.  EBI was taken by staff member prior to incident. "
02/20/2021,748.2855(a) - Individual Standards Evaluated,Individual Standards Evaluated,No,04/08/2021,04/07/2021,Individual Standards Evaluated,Medium,Yes,Staff member and operation staff admitted intervention used on the child was not documented by the staff who performed the restraint and operation was unable to provide documentation. ,"Operation followed up with staff, where staff admitted to improper restraint.  Staff was then terminated immediately after incident.  EBI was taken by staff member prior to incident. "
01/26/2021,748.4001(b) - Individual Standards Evaluated,Individual Standards Evaluated,No,03/09/2021,03/09/2021,Individual Standards Evaluated,High,Yes,"During interviews with children, it was reported the children left the operation without wearing seatbelts. The children also reported to laying down in the van during the transport. ","Compliance plan provide by the operation on 03.09.21. The employee denies the children were not wearing seatbelts when they left the operation. However, while transporting the children, the operational staff became aware of the children lying down and not wearing seatbelts. The employee has been advised that the children are to wear a seat belt whenever they are in a vehicle. The employee will retake the transportation training on March 9th, 2021. A copy of the certificate of completion has been provided. "
01/26/2021,748.2303(a) - Individual Standards Evaluated,Individual Standards Evaluated,No,03/09/2021,03/09/2021,Individual Standards Evaluated,High,Yes,Child in care was slapped by a staff member during transport. ,"03/09/21, compliance plan received by operation staff. Employee involved denied the allegations however, operation provided training on 03/04/21, regarding child rights to ensure caregiver understands and will abide by policy and procedures moving forward. "
01/26/2021,748.2307(9) - Individual Standards Evaluated,Individual Standards Evaluated,No,03/09/2021,03/09/2021,Individual Standards Evaluated,Medium High,Yes,It was confirmed through face to face interviews a staff member used inappropriate language towards children in care.,"3.9.21, compliance plan provided by operation. The employee was counseled regarding using appropriate language when supervising children in care. The employee completed child's rights training on March 4th, 2021. "
01/14/2021,748.1101(b)(4)(A)(v) - Individual Standards Evaluated,Individual Standards Evaluated,No,02/15/2021,02/11/2021,Individual Standards Evaluated,Medium High,Yes,Staff admitted to calling child in care crazy.,The compliance was met by the operation providing additional training on child rights. Also discussing how the staff's action were deemed inappropriate and demeaning. The staff was given a verbal warning and the notice was placed in their employee file. 
