Citation Date,Standard Number / Description,Category,Corrected at Inspection,Correction Deadline Date,Date Correction Evaluated,Sections Violated,Standard Risk Level,Technical Assistance Given,Deficiency Narrative,Correction Narrative
08/19/2025,748.1003(a) - Individual Standards Evaluated,Individual Standards Evaluated,Yes,09/04/2025,,Individual Standards Evaluated,Medium High,Yes,"During the time of the incident, there were 1 staff and six children. The operation also had a baby in the home at the time as well. The operation has a treatment director and has children in care that requires treatment services.",
08/19/2025,748.685(a)(5) - Individual Standards Evaluated,Individual Standards Evaluated,No,09/23/2025,09/29/2025,Individual Standards Evaluated,High,Yes,"During the incident, staff did not intervene appropriately which led to children being injured at the facility.",The owners conducted extra training with all staff regarding supervision expectations.  The operation has a scheduled staff meeting to discuss supervision as well as management conducting additional random checks of the staff.   
08/12/2025,748.505(b)(5) - Personnel,Personnel,No,08/18/2025,09/29/2025,E:Personnel,Medium,Yes,One of two caregiver files reviewed did not have documentation of the pre-employment affidavit on file.,
08/12/2025,748.151(3) - Individual Standards Evaluated,Individual Standards Evaluated,No,09/22/2025,09/29/2025,Individual Standards Evaluated,Medium,Yes,The administrators' timecards reviewed did not include accurate information reflected. ,
08/12/2025,745.4151(c)(8)(B) - Individual Standards Evaluated,Individual Standards Evaluated,No,08/18/2025,08/18/2025,Individual Standards Evaluated,High,Yes,One of two caregiver's file did not the results of the drug testing.,The operation emailed the missing document.  The drug test was dated 01/16/2025.
08/12/2025,748.531(a)(3) - Personnel,Personnel,No,09/22/2025,09/29/2025,E:Personnel,Medium,Yes,"There has not been a full-time administrator at the operation two of four weeks based on timecards reviewed.   
",The operation is currently without an administrator.  
08/12/2025,748.505(b)(3) - Personnel,Personnel,No,08/18/2025,09/29/2025,E:Personnel,Medium,Yes,One of two caregiver files reviewed did not have documentation showing the caregiver had the necessary skills.,
08/12/2025,748.505(b)(6) - Personnel,Personnel,No,08/18/2025,09/29/2025,E:Personnel,Medium High,Yes,One of two caregiver's file reviewed did not have documentation showing the pre-emoloymeent screening assessment.,The lacking pre-employment screening has now been completed and in the staff person's file.
08/12/2025,748.505(b)(4) - Personnel,Personnel,No,08/18/2025,08/18/2025,E:Personnel,Medium,Yes,One of two caregiver files reviewed did not have an affidavit on file. ,"The operation emailed the missing document.  The affidavit was dated May 1, 2024."
07/07/2025,748.303(a)(10)(A) - Individual Standards Evaluated,Individual Standards Evaluated,No,07/14/2025,07/08/2025,Individual Standards Evaluated,Medium,Yes,The operation failed to notify RCCR of the unauthorized absence of two youth in care.,The operation called and made the report of the unauthorized absence. 
07/07/2025,748.531(a)(3) - Individual Standards Evaluated,Individual Standards Evaluated,No,07/21/2025,08/12/2025,Individual Standards Evaluated,Medium,Yes,"There has not been a full time administrator at the operation for the last two of four weeks.   
",
05/23/2025,748.531(a)(3) - Individual Standards Evaluated,Individual Standards Evaluated,No,06/26/2025,07/07/2025,Individual Standards Evaluated,Medium,Yes,The operation was not able to provide verifiable proof that the administrator is working full time at the operation.,
04/14/2025,748.531(a)(3) - Personnel,Personnel,No,05/19/2025,05/23/2025,E:Personnel,Medium,Yes,"Based on the weekly schedule and timecards, the LCCA is not a full-time employee of the operation.",
04/14/2025,748.605(c) - Personnel,Personnel,No,05/19/2025,05/23/2025,E:Personnel,Medium,Yes,The named treatment director does not have documentation on file showing they meet the specific educational/professional qualifications.,
04/14/2025,748.751(b)(2) - Personnel,Personnel,No,04/21/2025,05/23/2025,E:Personnel,Medium Low,Yes,In the two staff file reviewed both had only one of the previous employers contacted to verify employment. ,"5/16/25: The owner emailed information regarding one of the employee's references. 

5/21/25: The owner emailed additional information for the 2nd employee. 

5/23/2025: The required information was verified during the onsite inspection #4058453.
"
04/14/2025,748.563(a) - Personnel,Personnel,No,05/19/2025,05/23/2025,E:Personnel,Medium,Yes,The PLSP file reviewed did not have documentation showing they meet the qualifications requirements.,
04/14/2025,748.753(a)(1) - Personnel,Personnel,No,04/21/2025,05/23/2025,E:Personnel,Medium,Yes,One of the staff file reviewed during the inspection did not include the required two references.   ,"5/16/25: The owner emailed information regarding one of the employee's references. 

5/21/25: The owner emailed additional information for the 2nd employee. 

5/23/2025: The required information was verified during the onsite inspection #4058453.
"
03/06/2025,748.1703(a) - Individual Standards Evaluated,Individual Standards Evaluated,Yes,03/08/2025,,Individual Standards Evaluated,Low,No,"During Walkthrough of the operation, it was discovered that the menu was not completely filled out and substitutions were not offered (Standard 1703 b).",
03/05/2025,748.303(a)(10)(A) - Individual Standards Evaluated,Individual Standards Evaluated,No,05/16/2025,05/21/2025,Individual Standards Evaluated,Medium,Yes,There are 3 runaway reports on the unauthorized absence log that indicate children were away from the operation more than 6 hours. The reports were not received timely and or documentation of the unauthorize absence log is incomplete. ,"The operation submitted a plan of correction the included updated policies to clearly align with the standards.   Also, all staff completed mandatory refresher training on reporting.  The operation also plans to do ongoing scenario-based reporting drills quarterly. "
03/05/2025,748.303(a)(6)(A) - Individual Standards Evaluated,Individual Standards Evaluated,No,05/16/2025,05/21/2025,Individual Standards Evaluated,Medium,Yes,A child in care was arrested from school. This was not reported. ,"The operation submitted a plan of correction the included updated policies to clearly align with the standards.   Also, all staff completed mandatory refresher training on reporting.  The operation also plans to do ongoing scenario-based reporting drills quarterly. "
03/04/2025,745.651(1) - Individual Standards Evaluated,Individual Standards Evaluated,No,03/07/2025,03/05/2025,Individual Standards Evaluated,Medium,Yes,"A caregiver is showing active in the operation people list, the caregiver has not been employed with the operation for twenty days.  ",The background check has been inactivated by the operation.  
03/04/2025,748.453(a)(2) - Reports and Record Keeping,Reports and Record Keeping,No,03/11/2025,03/08/2025,D:Reports and Record Keeping,Medium,Yes,"The unauthorized absence log did not include the time the absence was discovered by the staff on two of two occasions, the hotline report number for one of two occasions nor information on the length of time the youth was missing or if the youth returned on two of two occasions.",The owner emailed the updated completed unauthorized absence log with all required items listed. 
03/04/2025,748.3301(f) - Individual Standards Evaluated,Individual Standards Evaluated,No,03/11/2025,03/12/2025,Individual Standards Evaluated,Medium High,Yes,"During the outside walk through, sharp items and sharp glass was observed on the ground, near the barn. ",The owner emailed photos of the cleaned area now of the spots where the glass and sharp objects were during the inspection.
03/04/2025,748.831(b) - Training and Professional Development,Training and Professional Development,No,03/11/2025,03/31/2025,F:Training and Professional Development,Medium Low,Yes,"In one of two staff records reviewed, dates are missing from training documentation, unable to verify if pretraining was completed within 90 days of beginning job duties.",The operation emailed the completed orientation statement with dates listed for the staff records that had been missing during the inspection.   Compliance met
03/04/2025,748.363(2) - Reports and Record Keeping,Reports and Record Keeping,No,03/11/2025,03/08/2025,D:Reports and Record Keeping,Medium,Yes,"One of two staff records reviewed, did not detail how the staff was qualified for their role at the operation.",The owner emailed an updated job description with lesser educational requirements.
02/11/2025,745.641 - Individual Standards Evaluated,Individual Standards Evaluated,Yes,02/12/2025,,Individual Standards Evaluated,High,Yes,The operation has allowed two individuals access to children in care without received the eligibility notification.,
02/11/2025,748.4111(b)(1) - Transportation,Transportation,No,02/17/2025,02/17/2025,R:Transportation,Low,Yes,"At the time of the inspection, the operation did not have insurance for the vehicle being used to transport the children in care.",The insurance card submitted via email on 02/17/2025 had effective date of 02/17/2025 - 02/17/2026 as a temporary card.  
02/11/2025,748.1203(a) - Individual Standards Evaluated,Individual Standards Evaluated,No,02/18/2025,02/20/2025,Individual Standards Evaluated,Medium,Yes,The operation has admitted a child in care that does not meet the operation's admission policy.  ,"The owner and LCCA emailed the updated admission policy to include girls, both pregnant and not pregnant. "
02/11/2025,748.303(b) - Individual Standards Evaluated,Individual Standards Evaluated,Yes,02/11/2025,,Individual Standards Evaluated,Medium,Yes,A serious incident report was not completed for a medical event that occured at the operation. ,
02/11/2025,748.3301(a)(2) - Physical Site,Physical Site,No,02/17/2025,02/17/2025,P:Physical Site,Medium,Yes,"During today inspection, the well house was in need of maintenance. ",The operation emailed an updated photo of the well house with the repairs made and a latch re-installed. 
01/08/2025,748.3301(a)(2) - Physical Site,Physical Site,No,01/20/2025,02/11/2025,P:Physical Site,Medium,Yes,"During today inspection, several items were in need of maintenance. ",
10/08/2024,748.3313(2) - Physical Site,Physical Site,No,10/22/2024,10/22/2024,P:Physical Site,Medium Low,Yes,The water quality test was not done for the private water supply.,The water quality test has been completed.  
10/08/2024,748.3107(a)(2)(A) - Safety and Emergency Practices,Safety and Emergency Practices,No,10/22/2024,10/22/2024,O:Safety and Emergency Practices,Medium High,Yes,There was a smoke detector outside of one of the bedroom.,A smoke detector has been added to room #4. 
10/08/2024,748.125(g)(1)(A) - Organization and Administration,Organization and Administration,No,10/21/2024,11/12/2024,C:Organization and Administration,Medium,Yes,The suicide postvention written plan did not include the required items in 748.125(g)(B)(i) (I-VI).,The operation emailed the completed updated policies.
10/08/2024,748.103(b)(4) - Organization and Administration,Organization and Administration,No,10/22/2024,10/17/2024,C:Organization and Administration,Medium,Yes,"Operation is getting licensed for girls only, and biological girls that are currently pregnant, policies did not state this.  The application indicates children ages 14-17 are admitted, however the policy states ages 7-17.",The operation emailed the updated policies.
10/08/2024,748.103(b)(13) - Organization and Administration,Organization and Administration,No,10/22/2024,10/17/2024,C:Organization and Administration,Medium High,Yes,The tobacco policy did not address smoking in the vehicle.,The operation emailed the updated policies. 
10/08/2024,748.3391(c) - Physical Site,Physical Site,No,10/21/2024,10/22/2024,P:Physical Site,Low,Yes,Bedroom #4 did not have direct access to a bathroom without having to cross activity spaces. ,A hallway has been built for room #4 to access the bathroom.
10/08/2024,748.103(b)(3) - Organization and Administration,Organization and Administration,No,10/22/2024,10/17/2024,C:Organization and Administration,Medium,Yes,Conflict of interest policies did not meet the requirements of 748.107(1) and (2).,The operation emailed the updated policies.  
10/08/2024,748.103(b)(6) - Organization and Administration,Organization and Administration,No,10/22/2024,11/12/2024,C:Organization and Administration,Medium High,Yes,"The written EBI policies did not meet standard 748.2801(2)(A), 748.2901(a)(2) or (B), 748.113(a)(v), (viii), (ix) or (6).",The operation emailed the completed updated policies.
10/08/2024,748.125(c)(2) - Organization and Administration,Organization and Administration,No,10/22/2024,11/12/2024,C:Organization and Administration,Low,Yes,There was no policy that included this information.,The operation emailed the completed updated policies.
10/08/2024,748.103(b)(1) - Organization and Administration,Organization and Administration,No,10/22/2024,11/12/2024,C:Organization and Administration,Medium,Yes,Several policies violated the requirements of 748.303 and 748.313.  Further there were no policies for record storage in regards to SIRs. ,The operation emailed the completed updated policies.
10/08/2024,748.3395(a) - Physical Site,Physical Site,No,10/22/2024,10/22/2024,P:Physical Site,Medium,Yes,One bathroom sink had a crack in the bowl that was leaking in the under cabinet.,The crack in the sink in bathroom #1 has been repaired and is no longer leaking. 
10/08/2024,748.3021 - Safety and Emergency Practices,Safety and Emergency Practices,No,10/21/2024,10/22/2024,O:Safety and Emergency Practices,Medium High,Yes,A trailer was observed in the back yard with nails sticking up that could become hazardous to youth in care. ,A trailer that was observed in the back yard has been removed. 
10/08/2024,748.125(d)(4)(b)(i) - Organization and Administration,Organization and Administration,No,10/22/2024,11/12/2024,C:Organization and Administration,Medium High,Yes,The policy did not address any of the standards regarding children under the age of 10.,The operation emailed the completed updated policies.
10/08/2024,748.101(3) - Organization and Administration,Organization and Administration,Yes,10/08/2024,,C:Organization and Administration,Low,Yes,"The diagram did not include the designated location in the case of fire.

The diagrams were fixed during the inspection.",
