Citation Date,Standard Number / Description,Category,Corrected at Inspection,Correction Deadline Date,Date Correction Evaluated,Sections Violated,Standard Risk Level,Technical Assistance Given,Deficiency Narrative,Correction Narrative
06/07/2022,748.2307(9) - Individual Standards Evaluated,Individual Standards Evaluated,No,08/18/2022,08/18/2022,Individual Standards Evaluated,Medium High,Yes,Several children indicated staff uses profane language towards children in care. ,"An email was received from administrator. The administrator address staff with a memo. Staff were told to sign the memo for understanding. The memo stated the following: TIPS: THE PURPOSE OF THIS RULE IS TO PREVENT HARM TO CHILDREN DUE TO THE USE OF BEHAVIOR MANAGEMENT TECHNIQUES THAT EMOTIONAL PAIN OR DISCOMFORT. THESE PROHIBITED METHODS OF PUNISHMENT ARE CONSIDERED PHYSICALLY, PSYCHOLOGICALLY AND/OR EMOTIONALLY ABUSIVE.
APPLYING THIS WHILE ON DUTY: REMEMBER, THESE CHILDREN ARE IN OUR CARE DUE TO SOME TYPE OF ABUSE OR NEGLECT DIRECTLY OR INDIRECTLY.  THIS IS MORE REASON THEN EVER FOR US TO BE MINDFUL IN OUR INTERACTION WITH THEM.  IT MUST BE APPROPRIATE, PROFESSIONAL, AND ETHICAL.  THEY HAVE BEEN HURT IN ALL WAYS EMOTIONALLY, PHYSCIALLY, AND SEXUALLY, AND WE AS THEIR CAREGIVERS MUST ENSURE THAT WE DO NOT RE-TRAUMATIZE THEM WITH ANY TYPE OF ABUSE.  
"
05/28/2022,748.2851(b) - Individual Standards Evaluated,Individual Standards Evaluated,No,07/08/2022,07/13/2022,Individual Standards Evaluated,Medium,Yes,The child did not have a post discussion with a caregiver after she was restrained by the children.,"1.5 hours of training is being given to all staff and also reviewed with the children regarding EBI issues, protocol, supervision, and prudent judgment.  The topics being reviewed are detailed in the email send by Ms. Shan Dunn and uploaded into  digital storage.  A follow up inspection  is also being done on July 19, 2022."
05/28/2022,748.2551(c)(2) - Individual Standards Evaluated,Individual Standards Evaluated,No,07/08/2022,07/13/2022,Individual Standards Evaluated,High,Yes,"There were three girls on this child.  One straddling her torso, one holding her head, and one holding her ankles.  This could have caused pain, panic, or breathing problems for the child being restrained.","1.5 hours of training is being given to all staff and also reviewed with the children regarding EBI issues, protocol, supervision, and prudent judgment.  The topics being reviewed are detailed in the email send by Ms. Shan Dunn and uploaded into  digital storage.  A follow up inspection  is also being done on July 19, 2022.  Inspection was completed."
05/28/2022,748.2453 - Individual Standards Evaluated,Individual Standards Evaluated,No,07/08/2022,07/13/2022,Individual Standards Evaluated,High,Yes,A caregiver asked the other children in the home to help her restrain a child who needed to be hospitalized. The restraint was conducted by untrained teenagers.,"1.5 hours of training is being given to all staff and also reviewed with the children regarding EBI issues, protocol, supervision, and prudent judgment.  The topics being reviewed are detailed in the email send by Ms. Shan Dunn and uploaded into  digital storage.  A follow up inspection  is also being done on July 19, 2022.  Follow inspection was complete."
05/28/2022,748.2851(c)(2) - Individual Standards Evaluated,Individual Standards Evaluated,No,07/08/2022,07/13/2022,Individual Standards Evaluated,Medium Low,Yes,There has been nothing shared verbally or in writing by the children or staff that the situation was discussed with them.,"1.5 hours of training is being given to all staff and also reviewed with the children regarding EBI issues, protocol, supervision, and prudent judgment.  The topics being reviewed are detailed in the email send by Ms. Shan Dunn and uploaded into  digital storage.  A follow up inspection  is also being done on July 19, 2022."
05/28/2022,748.2855(a) - Individual Standards Evaluated,Individual Standards Evaluated,No,07/08/2022,07/13/2022,Individual Standards Evaluated,Medium,Yes,There was no documentation of this EBI restraint.  ,"1.5 hours of training is being given to all staff and also reviewed with the children regarding EBI issues, protocol, supervision, and prudent judgment.  The topics being reviewed are detailed in the email send by Ms. Shan Dunn and uploaded into  digital storage.  A follow up inspection  is also being done on July 19, 2022."
05/28/2022,748.507(1) - Individual Standards Evaluated,Individual Standards Evaluated,No,07/08/2022,07/13/2022,Individual Standards Evaluated,Medium High,Yes,"The caregiver did not use prudent judgment when she asked the other residents to help her to physically control the child who had swallowed glass.  The caregiver chose to look for more glass in the bedroom while this was happening.  The victim child could have been seriously injured.
","1.5 hours of training is being given to all staff and also reviewed with the children regarding EBI issues, protocol, supervision, and prudent judgment.  The topics being reviewed are detailed in the email send by Ms. Shan Dunn and uploaded into  digital storage.  A follow up inspection  is also being done on July 19, 2022."
05/19/2022,748.1583(a) - Child Care,Child Care,No,05/30/2022,05/23/2022,J:Child Care,Medium,Yes,One of the four children read had no TB test or results in the chart.,Email sent showing the TB test for the child with the missing test. See digital storage.
05/19/2022,748.2551(a) - Emergency Behavior Intervention,Emergency Behavior Intervention,No,05/30/2022,06/16/2022,N:Emergency Behavior Intervention,Medium High,Yes,"One staff chose to use a restraint on a child when the situation, as written, did not constitute an emergency.  ","A review with staff regarding the steps that are required to be taken before using any type of restraint.  They are also being retrained in a staff meeting about everything that needs to be documented after a restraint.  This will cover corrections for both deficiencies, and the form is in digital storage."
05/19/2022,748.2853(1) - Emergency Behavior Intervention,Emergency Behavior Intervention,No,05/30/2022,06/16/2022,N:Emergency Behavior Intervention,Medium Low,Yes,"In one of the restraint reports, there was nothing under the ""debriefing"" section.  In two other reports, the documentation was minimal and lacked detail.  ","A review with staff regarding the steps that are required to be taken before using any type of restraint.  They are also being retrained in a staff meeting about everything that needs to be documented after a restraint.  This will cover corrections for both deficiencies, and the form is in digital storage."
02/18/2022,748.685(a)(4) - Individual Standards Evaluated,Individual Standards Evaluated,No,04/01/2022,04/05/2022,Individual Standards Evaluated,High,Yes,At least one staff member has been dozing off during  her graveyard shifts and has been  seen sleeping by more than one child.,"An email  was sent stating that a formal reprimand was made against the  caregiver.  Also, all caregivers have signed rules with plans and ideas to stay awake while at work.  An inspection was completed on 4/7/21 to follow up."
02/06/2022,748.507(1) - Individual Standards Evaluated,Individual Standards Evaluated,No,03/23/2022,03/25/2022,Individual Standards Evaluated,Medium High,Yes,"The general responsibilities of all employees regardless of whether they are counted in the child/caregiver ratio is to demonstrate competency and prudent judgement in the absence of a more specific rule requirement. In this incident the two children were involved in a verbal altercation 30 min prior to arriving back at the facility, once at the facility one of the children is refusing to take verbal direction from staff and is attempting to make contact with the second child. While staff offered a chance to go to a separate house that evening, the second child refused and chose to return to ""White house"". Even after staff observed the other child outside and heard her making derogatory comments, they allowed the second child to return to her assigned housing where the altercation occurred.","The administrator indicated that in the future situations like this in which there are residents who seem hostile will be separated and if they refuse, the police will be call for assistance in the separation "
02/01/2022,748.2101(3) - Individual Standards Evaluated,Individual Standards Evaluated,Yes,02/01/2022,,Individual Standards Evaluated,Medium High,Yes,"The medication boxes at both the White and Corner House was observed during today's inspection, and both were in locked closet but the boxes were not locked.  When the individual boxes are not locked it operation is not meeting  the requirement to have these medication double locked.  Before I left each house I had the staff lock the combination boxes.  The boxes were checked and observed  as locked before I left each house.",
11/30/2021,748.1107(a) - Individual Standards Evaluated,Individual Standards Evaluated,No,02/10/2022,02/16/2022,Individual Standards Evaluated,Medium,Yes,It was determined that direct care staff were not allowing children in care to call their caseworkers.,"A memo was sent to all staff reiterating the above standard and reminding them to allow the  children at any time to call their  caseworkers, casa, ombudsman, or parents at any time.  See digital file."
11/23/2021,748.1103(d) - Children's Rights,Children's Rights,No,11/30/2021,11/30/2021,H:Children's Rights,Medium,Yes,One of four child records reviewed did not have a signed copy of the Child's Rights. There were two  unsigned copies of the child's rights in the child records. ,"A signed copy of the child's rights form, signed by the child in care, as well as the case worker. This form was emailed to the inspector."
10/31/2021,748.2203(c)(2) - Individual Standards Evaluated,Individual Standards Evaluated,No,11/12/2021,11/03/2021,Individual Standards Evaluated,Medium High,Yes,"Medication errors were marked in the records, but the codes and details in the error logs were delayed by 3 days.",documentation was sent to me with the new training she is giving to the medication  staff regarding the medication logs that were done incorrectly.  See Digital file
10/26/2021,748.3273(2) - Individual Standards Evaluated,Individual Standards Evaluated,No,11/05/2021,12/08/2021,Individual Standards Evaluated,Medium,Yes,"There were several things missing in the vans first aid kit, including: scissors, adhesive tape, tweezers, and gloves. ",The administrator was not there for this inspection and did not know corrections were ever sent.  New kits were purchased with all the correct items. See digital file for probation 8
10/12/2021,748.3365(b)(2) - Individual Standards Evaluated,Individual Standards Evaluated,No,10/15/2021,10/13/2021,Individual Standards Evaluated,Medium,Yes,"There were two beds in the gray house that were missing mattress protectors.  These were not vacant beds, so the staff was going to locate mattress protectors.",Pictures were sent of the beds that were missing mattress protectors the morning after the inspection. 
09/21/2021,"748.1331(a) - Admission, Service Planning, Discharge","Admission, Service Planning, Discharge",No,09/30/2021,11/05/2021,"I:Admission, Service Planning, Discharge",Medium Low,Yes,The preliminary service plan done for one child was not done in 72 hours-- it was 16 days late.,Preliminary service plan guidelines were written out and sent - see digital file  for details.
09/21/2021,"748.1335 - Admission, Service Planning, Discharge","Admission, Service Planning, Discharge",No,09/30/2021,11/03/2021,"I:Admission, Service Planning, Discharge",Medium Low,Yes,"One of the girl's initial service plan was completed 98 days after she was admitted.  This needs to be done within 45 days, and it should be signed by the treatment team.",Detailed  plans on the service plan guidelines for the agency were written out and sent to all administrative staff.  See digital file
08/20/2021,748.3365(c)(1) - Physical Site,Physical Site,Yes,08/20/2021,,P:Physical Site,Medium,No,One of the girls' beds had two pillows and no pillow cases.  This has become an ongoing problem.,
08/05/2021,748.1335 - Individual Standards Evaluated,Individual Standards Evaluated,Yes,08/05/2021,,Individual Standards Evaluated,Medium Low,Yes,In the child's record reviewed the initial  service plan was not completed timely.  The child was placed 6/4/21 and the plan was not completed until 8/3/21.,
07/21/2021,748.3365(c)(1) - Physical Site,Physical Site,No,07/23/2021,07/27/2021,P:Physical Site,Medium,Yes,"On the physical site walk-through, there was a bed in the white house had two pillows without cases.","Along with correcting it while I was there, the staff received a ""final blanket warning"" for the sheets, pillow cases and bedding.  They are now to be checking after every shift and making notes that all bedding is on every bed.  Individual penalties will be applied if it happens again."
06/28/2021,748.3239(d) - Safety and Emergency Practices,Safety and Emergency Practices,No,07/07/2021,07/07/2021,O:Safety and Emergency Practices,Medium Low,Yes,"The last fire drill was done in November of 2020, so one would be needed in May 2021.  There were no diaster drills on file.  These also need to be done every 6 months.",Staff have anew schedule where they will be assured that drills are occurring as needed. See digital file
06/28/2021,748.3443(a)(1) - Individual Standards Evaluated,Individual Standards Evaluated,No,07/07/2021,07/07/2021,Individual Standards Evaluated,Medium,No,There were several containers of juice and chips on the  floor in the food pantry.,"pictures sent of pantries, and memo sent out to all the houses regarding keeping all foods off the floor."
06/23/2021,748.1331(a) - Individual Standards Evaluated,Individual Standards Evaluated,No,07/02/2021,07/06/2021,Individual Standards Evaluated,Medium Low,Yes,There was no preliminary service plan completed for two children who  were admitted on 6/8/21.,Today during the HM Inspection I observed the two resident's case file and found that both plan had been completed.  
06/22/2021,748.151(2) - Individual Standards Evaluated,Individual Standards Evaluated,No,08/16/2021,08/24/2021,Individual Standards Evaluated,Medium,Yes,The policy with ETOD is to have kids in eye or ear shot -and to check on them every 15 minutes or more if it is in their plan.,"New guidelines were put in the Gray house, and the girls are no longer allowed to have other girls in their rooms.  Only one is allowed in the game room at a time, and staff has to sit in the girls's rooms if they want to be in one another's rooms."
06/15/2021,"748.1341(a) - Admission, Service Planning, Discharge","Admission, Service Planning, Discharge",No,06/24/2021,06/25/2021,"I:Admission, Service Planning, Discharge",Low,No,One of the two child records read was missing a 14 day notice for a service plan.,Ms. Doan and Ms. Dunn have implemented a better checks and balance system so they don't miss the notices or time frames on the girls initial and subsequent treatment plans.
06/08/2021,748.4657(1) - Individual Standards Evaluated,Individual Standards Evaluated,Yes,06/08/2021,,Individual Standards Evaluated,Medium,Yes,"In  review of the staff records, one staff had a total of 44 annual training hour for 2020.  The operation had corrected the issue at the time of inspection by making the staff make up 6 additional hours of training in Jan 2021.",
06/08/2021,748.303(a)(6)(A) - Individual Standards Evaluated,Individual Standards Evaluated,No,06/18/2021,06/23/2021,Individual Standards Evaluated,Medium,Yes,"In review of the serious incident reports, there was one report of a child being arrested that was not reported timely.  The incident occurred 5/22/21 and was not reported until 5/24/21.","During my inspection on today I reviewed the following information  that was sent out in a memo to staff on 6/14/21 from the Administrator:

On the incident report, in the section that lists SERIOUS incidents: these are the following incidents that must be reported to the Texas Abuse Hotline (1-800-252-5400 ) and On-Call personnel immediately. 

These situations must also be written on an incident report.

Must include what occurred (circle the incident) , when it occurred (write the date and time), where the incident occurred (what area of the house/what house), how the incident occurred (behaviors that took place before the crisis situation/what happened leading up to the situation), who the incident involved (all staff and kids) the result of the situation (what occurred after the incident, ex: child was taken to the hospital and did not return/did return.) 

If a restraint occurred, please complete the incident report with restraint form thoroughly. Include the restraint technique used ( low level hold, etc.). Anytime a restraint is used, must notify on call immediately. 

All incident reports must be written immediately and turned into the office within 24 hours of the incident occurring. 

Please sign and acknowledge that you have read and understood this memo. 
"
03/18/2021,748.3391(a) - Individual Standards Evaluated,Individual Standards Evaluated,No,03/25/2021,03/25/2021,Individual Standards Evaluated,Medium High,Yes,"Bathroom shower in the Green House had black mold and soap scum on the walls, floor and shower door. ",Several pictures were sent to Kedrick Pinke to show that the bathroom was cleaned.  See digital file.
02/23/2021,748.311 - Individual Standards Evaluated,Individual Standards Evaluated,No,04/07/2021,04/09/2021,Individual Standards Evaluated,Medium,Yes,"Although the serious incident was called in to SWI, no written report was given to the Abuse/Neglect investigator - after one month of requests.","Document was sent to all staff - and reviewed in staff meeting what was a serious incident, and the steps that need to be taken to document and report.  See digital file."
01/31/2021,748.681(3) - Individual Standards Evaluated,Individual Standards Evaluated,No,03/11/2021,03/03/2021,Individual Standards Evaluated,Medium,Yes,"The staff/medical liaison did not communicate pertinent information to Psychiatrist about the child, which likely would have made a difference in the child's medical/emotional health and treatment.","Corrections were sent where the medical liaison was written up and retrained on what is needed - things to be reviewed, etc. when going to Dr. appointments.."
01/30/2021,748.2003(b)(5) - Individual Standards Evaluated,Individual Standards Evaluated,Yes,02/04/2021,,Individual Standards Evaluated,Medium High,Yes,A staff member gave a child a double dose of her prescribed medication.,
01/14/2021,745.621(b)(1)(B) - Individual Standards Evaluated,Individual Standards Evaluated,No,01/21/2021,01/21/2021,Individual Standards Evaluated,High,Yes,"An employee left the operation January 2019 and was rehired July 2019.  The previous background check was good until August 2020.  The employee was not entered in the system at the time of re-hire, therefore the employee was not on the persons list and does not have a current background check.  
",CLASS shows that the background for the staff was submitted 1/15/21.
11/12/2020,748.309 - Individual Standards Evaluated,Individual Standards Evaluated,No,01/08/2021,03/03/2021,Individual Standards Evaluated,Medium,Yes,The administrator was made aware of a runaway child using illegal substances with a staff member and did not report it prior to doing internal investigation.,reporting corrections were sent on this day in regards to this case.  See digital file.
09/25/2020,748.1101(b)(1)(B) - Individual Standards Evaluated,Individual Standards Evaluated,No,12/07/2020,12/04/2020,Individual Standards Evaluated,High,No,A child in care was physically and inappropriately grabbed by a staff member when she tried to leave the facility.,"A follow-up was made on this day via a Heightened Monitoring inspection by me, Denise Killgore, in place of Yolanda Love.  The lady who had improperly restrained the child had been fired, and additional training had been done with all staff at the facility."
09/25/2020,748.2303(a) - Individual Standards Evaluated,Individual Standards Evaluated,No,12/07/2020,12/04/2020,Individual Standards Evaluated,High,Yes,A caregiver used unnecessary force and an improper restraint to contain a  child who was trying to run.,"A follow-up was made on this day via a Heightened Monitoring inspection by me, Denise Killgore, in place of Yolanda Love.  The lady who had improperly restrained the child had been fired, and additional training had been done with all staff at the facility"
09/11/2020,748.1013(a) - Individual Standards Evaluated,Individual Standards Evaluated,No,10/23/2020,11/03/2020,Individual Standards Evaluated,High,No,"It was determined that at least one staff member sleeps while on shift, therefore is not providing care for children who require close supervision. ",Documentation was sent showing that the staff who was sleeping was terminated.  They also hired a night security guard who will making rounds every hour at night to ensure that staff is not sleeping.
